100,1021,TRUE,R_1qh6LlJIXd5xRv2,,,,,,,,,,,,,,,,,,,,,,,,,,,,,,,,,,,,,,,,,,,,,,,,,Tell the boss the truth,Count the cash register again,See if the boss knows anything about the missing money,Write a check for the missing money,Close the store and leave before the boss shows up,15.968,15.968,98.507,1,100,100,100,100,100,100,100,100,100,70,60,40,30,20,10,Put a note on the friends car,Have the desk tell her friend she couldn't make it,Wait for until she sees her friend,Just leave,Pay here past due bill,16.719,65.185,92.497,2,80,100,80,100,100,80,100,100,100,40,30,20,100,100,80,,,,,,,,,,,,,,,,,,,,,,,,,See if his sell phone works.,Walk to where he thinks the town is.,Start a fire for the smoke.,Make camp.,Hunt for some type of food.,20.609,100.031,101.584,5,100,100,100,90,100,100,90,100,100,100,100,100,80,100,100,,,,,,,,,,,,,,,,,,,,,,,,,,,,,,,,,,,,,,,,,,,,,,,,,,,,,,,,,,,,,,,,,,,,,,,,,,,,,,,,,,,,,,,,,,,,,,,,,,,,,,,,,,,,,,,,,,,,,,,,,,,,,,,,,,,,,,,,,,,,,,,,,,,,,,,,,,,,,,,,,,,,,,,,,Move his dad to assisted living,Have his dad move in with him and get a nurse,Leave him in his home and get a nurse,Put him in a nursing home,Leave him in his existing position,7.073,144.964,153.759,8,90,90,100,100,100,100,100,100,100,80,60,50,0,0,0,Conserve food,Relax,Watch TV,Play a game,Go to your cabin,15.905,15.905,94.663,1,100,100,100,70,80,70,60,100,70,90,100,100,80,70,75,,,,,,,,,,,,,,,,,,,,,,,,,Relax it's only 6AM,Call his boss,Call the court,Call another employee to cover his shift,Close the store,13.345,13.345,70.671,1,60,100,100,100,100,90,70,100,80,90,80,90,60,50,50,,,,,,,,,,,,,,,,,,,,,,,,,,67,Male,White / Caucasian,,Some College,Rung 6
100,853,TRUE,R_WCcxcIhPVpkBPRD,,,,,,,,,,,,,,,,,,,,,,,,,,,,,,,,,,,,,,,,,,,,,,,,,Put in cash if he has some in his pocket.,Go review the video footage to see who stole it.,Take the rest of the money and just leave.,Pretend he didn't notice the missing money.,Ask his co-workers if they know what happened.,5.23,42.557,43.727,6,50,78,3,84,98,94,12,4,3,52,41,45,90,90,90,,,,,,,,,,,,,,,,,,,,,,,,,,,,,,,,,,,,,,,,,,,,,,,,,,,,,,,,,,,,,,,,,,,,,,,,,,,,,,,,,,,,,,,,,,,,,,,,,Ask the teenager what he's doing.,GO ask the family if they know the teenager,Grab or physicall accost the teenager,Go get a lifeguard and ask for help,"Start throwing sand at the teenager,",10.243,10.243,57.997,1,95,94,94,56,57,66,33,26,46,35,77,58,5,13,7,,,,,,,,,,,,,,,,,,,,,,,,,,,,,,,,,,,,,,,,,,,,,,,,,,,,,,,,,,,,,,,,,,,,,,,,,,,,,,,,,,,,,,,,,,,,,,,,,Leave to go buy another ring quickly.,Make a joke about it.,Find another ring in the crowd.,Try to go call the taxi company to have them bring it to him.,Start crying,1.002,30.843,35.363,3,47,96,47,61,42,56,75,81,67,95,75,85,23,7,13,Have his father move in with him.,Hire at-home help to help his father in his own house.,Pay for his father to move to an assisted living facility.,Retire and spend more time with his father.,Have his father move in with him and hire at home help.,1.176,1.176,52.797,1,51,96,84,68,91,85,76,51,85,19,91,55,23,92,40,,,,,,,,,,,,,,,,,,,,,,,,,Leave temporarily to go get water and help.,Take deep breaths and try to free his finger again.,Try to create some shade.,Tell Todd he needs to try harder to pull his finger out.,Cut Todd's finger off so they can leave.,3.023,10.885,54.729,2,90,87,91,61,85,87,49,100,55,22,22,27,0,3,3,Call his boss to see where he is.,Call a worker to see if they can take his shift.,Plan to put up a sign saying the store is closed and lock up if he has to leave.,Leave to go to his bosses house to see if he can find him.,Skip his court appointment.,1.77,1.77,74.122,1,95,97,98,99,97,98,77,86,79,17,46,19,8,10,9,,,,,,,,,,,,,,,,,,,,,,,,,,36,Male,White / Caucasian,,Master's Degree (MS),Rung 9
100,1030,TRUE,R_0dl7wBAgxdxY5j3,Use his credit card to purchace the medication.,"Set up a ""go fund me"" to help pay for the medication on-line.",Borrow money from a family member to pay for the medication.,Take out a personal loan to pay for the medication.,Sell some of his stuff to pay for the medication.,6.506,58.095,74.061,5,91,100,100,60,100,93,50,70,62,61,72,51,9,100,20,Get out of his car and begin to walk back towards the last town he saw.,Flag down a passing vehicle and ask for help.,"Call 911 with his phone, as that feature should still work.","Get out of the car and walk around until he gets cell service, then call a cab or tow truck.",See if he can fix the car himself; pop the hood and see if it's something simple that he can fix.,18.523,128.551,130.073,12,60,90,40,91,91,91,20,60,50,70,100,81,81,100,100,,,,,,,,,,,,,,,,,,,,,,,,,,,,,,,,,,,,,,,,,,,,,,,,,,,,,,,,,,,,,,,,,,,,,,,,,,,,,,,,,,,,,,,,,,,,,,,,,Give Ted her ticket.,Call a friend and see if they can bring the ticket to Ted.,"Skip the concert, as Ted won't be able to attend, either.",Sneak Ted in. ,Try to buy a ticket from black market hawkers on the street.,7.713,97.082,132.087,9,80,100,72,81,100,100,61,100,100,50,51,51,30,32,80,,,,,,,,,,,,,,,,,,,,,,,,,,,,,,,,,,,,,,,,,,,,,,,,,Give her a lift anyway.,Call a cab and pay the fare for her. ,Order an Uber for her and pay the fare.,Refuse to drive her or help her.,"Ask if her car is broke down, and offer to call a tow truck for her.",7.298,45.392,108.005,5,60,100,71,71,71,80,72,81,100,10,5,20,30,40,40,,,,,,,,,,,,,,,,,,,,,,,,,,,,,,,,,,,,,,,,,,,,,,,,,Panic and cry.,"Explain the situation to the Groom, then call the taxi company and see if they can rush the ring back.",Apologize profusely to the Bride and Groom. ,See if the Bride and Groom would be willing to skip the ring for the time being.,Slip of his own wedding ring and offer it to his friend.,3.25,90.221,116.404,9,50,73,91,100,100,100,100,100,100,51,41,53,29,83,51,,,,,,,,,,,,,,,,,,,,,,,,,,,,,,,,,,,,,,,,,,,,,,,,,,,,,,,,,,,,,,,,,,,,,,,,,,,,,,,,,,,,,,,,,,,,,,,,,Ask him if he is ok.,Keep going.,Ask him if his dogs are ok. ,Ask him if she is still going the right way for the race.,Ignore him.,16.387,76.332,91.248,5,71,100,80,92,81,100,71,100,51,19,100,70,51,61,82,,37,Female,White / Caucasian,,College Graduate (4 year),Rung 3
100,907,TRUE,R_1FycRjUQTaa5x01,,,,,,,,,,,,,,,,,,,,,,,,,,,,,,,,,,,,,,,,,,,,,,,,,,,,,,,,,,,,,,,,,,,,,,,,,,,,,,,,,,,,,,,,,,,,,,,,,,,,,,,,,,,,,,,,,,,,,,,,,Go to the nearby town,Starve,Try to find their way back to the proper route,See if he's able to call the local police for help,Freeze,10.69,75.03,75.591,4,100,100,100,0,10,0,25,75,50,10,100,30,0,0,0,,,,,,,,,,,,,,,,,,,,,,,,,Ask the teen if those are their belongings,Go tell the family what's happening,Tackle the teen,Ignore it,Kick sand into the teen's eyes,9.997,9.997,90.66,1,70,100,100,60,100,100,0,0,0,50,50,50,0,0,0,,,,,,,,,,,,,,,,,,,,,,,,,Take her where she needs to go,"Say that he would, but he has somewhere to be",Tell her he could only afford enough gas to get where he needs to go,Act like he didn't hear her,Give her money to take an Uber,8.721,8.721,90.5,1,100,100,100,25,100,100,10,100,70,0,0,0,10,100,40,Go to the main office at the mall and have them make an announcement over the loudspeaker,Call the police,Call animal control,Break the window,Walk on past,2.536,2.536,51.298,1,30,100,100,30,80,50,0,70,40,0,0,0,50,0,50,,,,,,,,,,,,,,,,,,,,,,,,,,,,,,,,,,,,,,,,,,,,,,,,,,,,,,,,,,,,,,,,,,,,,,,,,,,,,,,,,,,,,,,,,,,,,,,,,,,,,,,,,,,,,,,,,,,,,,,,,Call his boss,Call another employee to see if they can cover in case his boss doesn't show up,Chill out because there's still an hour left before he usually gets there,Text his boss to make sure he won't be running late,Make sure he has everything ready to go so he can leave as soon as his boss arrives,14.134,106.538,142.798,2,10,100,25,10,80,20,100,100,100,30,100,100,100,100,100,Ask him if he's okay,Just ride on past,Throw a snowball at him,Tell him that smoking is bad for him,Stop and smoke with him,9.792,9.792,88.86,1,70,100,90,80,90,100,0,0,0,0,80,10,0,0,0,,34,Male,White / Caucasian,,College Graduate (4 year),Rung 6
100,1112,TRUE,R_27eWGw2EuB5MkIM,,,,,,,,,,,,,,,,,,,,,,,,,,,,,,,,,,,,,,,,,,,,,,,,,Check cameras,Talk to employees who work the register,Be upfront with his boss,Cover the shortage,Recount the money to double check,49.722,49.722,147.728,1,93,100,100,72,100,100,36,100,100,9,62,13,100,100,100,ask to borrow someone's phone,pay her dues,wait for her friend to arrive ,ask if she could use the phone at the gym,leave,18.064,55.467,74.798,2,57,100,94,58,100,100,71,85,89,26,87,75,87,75,75,,,,,,,,,,,,,,,,,,,,,,,,,hike to the nearby town at the base of the mountain,find their way back to the planned route,look for a water source,Turn around,send off a help signal,16.069,16.069,84.424,1,90,100,100,50,59,60,65,75,76,22,29,30,31,74,69,,,,,,,,,,,,,,,,,,,,,,,,,,,,,,,,,,,,,,,,,,,,,,,,,,,,,,,,,,,,,,,,,,,,,,,,,,,,,,,,,,,,,,,,,,,,,,,,,,,,,,,,,,,,,,,,,,,,,,,,,,,,,,,,,,,,,,,,,,,,,,,,,,,,,,,,,,,,,,,,,,,,,,,,,move his father in with him,hire someone to help his father,move his father to a retirement home,spend lots of time at his father's house helping him,put him in a home,9.117,9.117,93.947,1,74,100,94,87,100,93,68,85,87,88,95,95,45,62,73,limit the food everyone got,tell the passengers what was happening,not be truthful with passengers and risk food running out,nothing,nothing,20.495,101.224,101.789,2,90,95,96,98,100,100,9,6,6,1,1,1,1,1,1,,,,,,,,,,,,,,,,,,,,,,,,,not panic it's not 7 yet,call his boss,contact the court to let them know he is waiting for relief at his job,leave,text his boss,31.759,31.759,82.648,1,50,88,89,72,100,100,39,93,85,8,14,10,100,100,100,,,,,,,,,,,,,,,,,,,,,,,,,,36,Female,White / Caucasian,,College Graduate (4 year),Rung 5
100,1112,TRUE,R_yWKBFrNwlUMxs7D,Start a go fund me for the dogs medicine,Pay using a credit card and make payments,Order the medicine from out of the United States so the price is astronomically cheaper,Steal the medicine if an opportunity arises ,Contact the company and ask them to lower the price for his dog to survive,5.206,97.066,156.222,8,100,100,100,90,100,100,100,100,100,60,75,25,100,100,100,Attempt to repair the vehicle using any tools he may have,"Using his cell phone flashlight, attempt to flag down someone",Walk to the nearest area to get cell service or call someone,Try to push his vehicle down the road to any nearby home,Push his car in the road to try an stop traffic to get a ride,0.804,141.765,142.122,2,100,100,100,100,100,100,100,100,100,60,100,90,0,0,0,Start checking security footage to see if someone stole the money,Talk to the manager and see what can be figured out on how that much was missing,Punch himself in the face and pretend someone robbed the store,Lie and say everything is in order in hopes the manager doesn't figure it out,Prepare to file for unemployment,1.139,48.904,186.105,3,100,100,100,100,100,100,20,0,0,60,0,0,60,75,75,,,,,,,,,,,,,,,,,,,,,,,,,Show the professor what happened and get an extension,Attempt to redo the homework from memory quickly,Take a 0 on the homework,Skip the class and lie about it being an emergency,Take someone else's homework to turn in as her own,1.168,88.544,95.444,4,100,100,100,90,100,100,5,50,50,40,0,50,0,0,0,,,,,,,,,,,,,,,,,,,,,,,,,Buy a ticket from a scalper at the front gate,Give ted her ticket,Ask one of the friends to give up their ticket,Attempt to speed home to get the ticket,Go somewhere else as a group and celebrate elsewhere,1.962,75.301,95.468,2,100,80,80,100,100,100,70,20,20,60,70,70,90,60,60,,,,,,,,,,,,,,,,,,,,,,,,,,,,,,,,,,,,,,,,,,,,,,,,,,,,,,,,,,,,,,,,,,,,,,,,,,,,,,,,,,,,,,,,,,,,,,,,,,,,,,,,,,,,,,,,,,,,,,,,,,,,,,,,,,,,,,,,,,,,,,,,,Ask his father to move in with him,Hire someone to take care of his father at their home,Pay to have his father moved to an assistive living home,Go to his fathers house each day to help him with whatever he needs,Take time off each week to stay with his father and help him,7.757,91.083,106.323,4,100,100,100,100,100,100,100,100,100,100,100,100,100,100,100,,,,,,,,,,,,,,,,,,,,,,,,,,,,,,,,,,,,,,,,,,,,,,,,,,,,,,,,,,,,,,,,,,,,,,,,,,,,,,,,,,,,,,,,,,,,,,,,,,30,Male,White / Caucasian,,College Graduate (4 year),Rung 3
100,1165,TRUE,R_1jrBoUwy1fJ4jZ1,Take out a loan,borrow money,sell items to get cash,set up a payment plan,steal money,26.773,26.773,63.372,1,100,100,100,100,100,100,80,100,100,100,100,100,25,0,5,,,,,,,,,,,,,,,,,,,,,,,,,Review Transactions,Ensure voids are correct,Take out cash drawer and see if money got stuck,Recount cash,own up to the outage,24.329,24.329,72.535,1,100,100,100,100,100,100,100,100,100,100,100,100,85,100,100,,,,,,,,,,,,,,,,,,,,,,,,,,,,,,,,,,,,,,,,,,,,,,,,,,,,,,,,,,,,,,,,,,,,,,,,,,,,,,,,,,,,,,,,,,,,,,,,,,,,,,,,,,,,,,,,,,,,,,,,,call his friend to see if it is him,call the police,pass the driver and see who it is,Beep horn and flash lights to get the drivers attention,pull over and wait till car is further ahead to avoid an accident,53.273,53.273,131.187,1,100,100,100,50,100,100,75,100,100,100,100,100,30,30,50,,,,,,,,,,,,,,,,,,,,,,,,,,,,,,,,,,,,,,,,,,,,,,,,,Back out of the line ,tell the truth to security,throw it out,lie to security and say he forgot he had this,do not stay it was illegally imported,31.166,31.166,100.956,1,100,100,100,50,100,65,20,50,20,80,40,90,100,40,75,,,,,,,,,,,,,,,,,,,,,,,,,Have his father move in,pay for his father to get in home care (medical),move his father to a nursing home,come over often to assist his father,"pay for help services (cleaning, cooking, etc)",10.74,71.8,76.839,2,85,100,100,80,100,100,20,50,50,100,100,100,85,100,100,,,,,,,,,,,,,,,,,,,,,,,,,,,,,,,,,,,,,,,,,,,,,,,,,Text the owner,call the owner,be paietent since it is only 6,close the store if his boss does not show,miss his court appointment,211.012,219.178,290.484,2,100,100,100,100,100,100,85,100,100,50,100,100,50,100,50,,,,,,,,,,,,,,,,,,,,,,,,,,43,Male,White / Caucasian,,Master's Degree (MS),Rung 8
100,1193,TRUE,R_1dFAOxeg07f43gd,,,,,,,,,,,,,,,,,,,,,,,,,,,,,,,,,,,,,,,,,,,,,,,,,,,,,,,,,,,,,,,,,,,,,,,,,,,,,,,,,,,,,,,,,,,,,,,,,redo her work,ask teacher for extension,take the bad grade,dry out her backpack,stay after class to complete it,1.402,11.728,59.864,2,80,100,100,80,90,100,50,90,86,100,100,100,61,92,100,,,,,,,,,,,,,,,,,,,,,,,,,,,,,,,,,,,,,,,,,,,,,,,,,shout at the teenager,tell the family,send over the lifeguard,take care of it herself,ask family if teenager is theirs,1.838,33.15,39.247,2,80,72,100,95,100,100,61,71,69,69,72,79,100,100,100,honk his horn,call police (what if the friend is intoxicated?),call him via bluetooth/handsfree,pass him,check license plate,45.224,45.224,93.056,1,70,70,70,20,30,30,75,65,80,80,60,60,60,90,90,,,,,,,,,,,,,,,,,,,,,,,,,,,,,,,,,,,,,,,,,,,,,,,,,,,,,,,,,,,,,,,,,,,,,,,,,call the taxi company,chase the taxi on foot,panic,be honest about what happened,lie about losing it,1.031,1.367,30.198,2,100,100,100,50,72,63,100,100,100,50,100,91,30,7,77,have his father live with him,pay for assisted living,hire a nurse,do nothing/let him wither away,care for his father himself,2.717,2.717,54.862,1,80,100,100,72,90,100,72,100,100,5,0,0,50,100,100,,,,,,,,,,,,,,,,,,,,,,,,,cut off his finger to free him,find water,go down the mountain for help,call for help (maybe there are other hikers),leave todd to die of exposure,1.6,550.344,612.23,5,10,0,0,60,100,100,71,80,100,100,100,100,0,0,0,,,,,,,,,,,,,,,,,,,,,,,,,,,,,,,,,,,,,,,,,,,,,,,,,,35,Female,White / Caucasian,,College Graduate (4 year),Rung 3
100,782,TRUE,R_2EAX8oz6SlYo7zE,start GoFundMe,rehome the dog,ask family for $,have the dog put down,surrender dog to shelter,7.493,7.493,72.06,1,75,100,88,52,100,100,52,52,72,8,8,20,25,15,40,he can walk to airport,he can flag down another vehicle,he can walk until he has cell service,he can sit in the car and cry,he can get angry at the car and wait for someone to come,1.335,1.335,70.779,1,10,40,9,60,70,91,40,93,64,30,30,61,40,22,62,,,,,,,,,,,,,,,,,,,,,,,,,,,,,,,,,,,,,,,,,,,,,,,,,,,,,,,,,,,,,,,,,,,,,,,,,he could make his way to the town,he could try to get them back on planned route,he could give others some of his food,he could give up and go home,he could ask for help,1.114,1.114,57.506,1,75,100,100,65,60,50,40,80,40,30,70,36,100,100,100,,,,,,,,,,,,,,,,,,,,,,,,,,,,,,,,,,,,,,,,,,,,,,,,,,,,,,,,,,,,,,,,,,,,,,,,,he could give her a ride,he could tell her no,he could bring her close and have her take a cab the extra way,he could ask where others are going,he could offer her to use his bike,1.65,1.65,67.6,1,85,100,100,20,10,10,50,100,70,10,0,0,30,50,50,break window,call police,take dog,have owners paged,take pictures and post on social media,1.808,1.808,34.567,1,50,78,79,92,100,100,20,0,10,91,100,100,30,1,55,,,,,,,,,,,,,,,,,,,,,,,,,call the cab company,have others call cab company,buy another ring,tell the groom,just tell the truth to all,1.093,1.093,38.301,1,100,100,100,62,50,51,24,18,1,100,100,100,100,100,100,,,,,,,,,,,,,,,,,,,,,,,,,,,,,,,,,,,,,,,,,,,,,,,,,,,,,,,,,,,,,,,,,,,,,,,,,,,,,,,,,,,,,,,,,,,,,,,,,,,,,,,,,,,,,,,,,,,,,,,,,,46,Female,White / Caucasian,,Vocational/Technical School (2 year),Rung 3
100,1046,TRUE,R_12MfBOJFldOJWaE,,,,,,,,,,,,,,,,,,,,,,,,,hitchhike,walk,press onstar button in car,break things,rob someone,11.541,11.541,111.753,1,10,60,25,10,100,100,100,100,100,50,1,40,1,1,50,,,,,,,,,,,,,,,,,,,,,,,,,go get her phone and miss game,tell friend what happened later ,apply for a quick loan when she gets back to work to pay off gym dues,look into different gyms,have lunch instead,9.366,104.848,139.401,4,100,100,100,100,100,100,50,50,1,50,100,100,50,100,100,,,,,,,,,,,,,,,,,,,,,,,,,,,,,,,,,,,,,,,,,,,,,,,,,party in the parking lot,pay his stupid tax,shrug,laugh,regret decisions,19.681,19.681,48.557,1,50,100,100,1,100,100,50,100,100,50,1,100,1,100,100,,,,,,,,,,,,,,,,,,,,,,,,,,,,,,,,,,,,,,,,,,,,,,,,,give her a ride,make an excuse,assault her ,get her a lyft,get her an uber,10.588,10.588,57.801,1,50,100,100,50,50,100,50,1,50,50,100,100,50,100,100,,,,,,,,,,,,,,,,,,,,,,,,,leave,pretend his phone is ringing,feign diarrhea,feign panic attack,feign covid,10.801,10.801,71.902,1,50,50,50,50,50,50,50,50,50,50,50,50,49,48,49,,,,,,,,,,,,,,,,,,,,,,,,,become a longterm caregiver,become a shortterm caregiver,pay an in home caretaker,grease palms in nursing homes,lease a second apartment,9.405,9.405,184.379,1,15,100,100,30,100,100,50,100,100,50,1,50,50,100,100,,,,,,,,,,,,,,,,,,,,,,,,,,,,,,,,,,,,,,,,,,,,,,,,,,,,,,,,,,,,,,,,,,,,,,,,,,,,,,,,,,,,,,,,,,,,,,,,,,35,Female,White / Caucasian,,Some College,Rung 2
100,832,TRUE,R_3szcWXLogqzopW7,,,,,,,,,,,,,,,,,,,,,,,,,,,,,,,,,,,,,,,,,,,,,,,,,,,,,,,,,,,,,,,,,,,,,,,,,She could explain the situation to the gym,She could just tell her friend about what happened later,She could rush past the front desk and yell the information to her friend,She could throw a fit and ask to speak to the manager,She could just leave and tell her friend she was busy,21.288,94.883,106.475,5,100,100,100,100,100,100,3,88,1,29,49,75,31,65,84,,,,,,,,,,,,,,,,,,,,,,,,,,,,,,,,,,,,,,,,,,,,,,,,,,,,,,,,,,,,,,,,,,,,,,,,,,,,,,,,,,,,,,,,,,,,,,,,,,,,,,,,,,,,,,,,,,,,,,,,,He could give her a ride,He could not give her a ride,He could call her a taxi,He could order her an uber,He could kidnap and kill her and leave her body in a dumpster,7.345,28.003,92.764,2,98,100,100,50,100,100,19,100,100,30,100,100,0,0,0,,,,,,,,,,,,,,,,,,,,,,,,,,,,,,,,,,,,,,,,,,,,,,,,,He could tell the couple what happened,He could call the taxi company,He could lie and say he doesn't know where it is,He could run away through the wall like the Koolaid man,He could move to Mexico and change his name to Louis,6.485,6.903,97.673,2,100,100,100,100,100,100,50,18,78,0,0,0,1,20,2,He could invite him to live in the apartment,He could send him to a nursing home,He could hire a nurse,He could hire a nanny,He could do nothing.,6.748,45.977,63.495,4,83,100,100,69,100,100,99,100,100,54,100,100,48,46,92,He should tell them to remain calm,He should inform them that rescue is on the way,He should tell the crew to keep an eye on the passengers,He should tell them to be courteous with the food supply,He should tell the crew to ration food and water.,18.711,46.319,109.337,2,90,100,100,100,100,100,51,100,100,51,100,100,69,100,100,,,,,,,,,,,,,,,,,,,,,,,,,,,,,,,,,,,,,,,,,,,,,,,,,She could ignore it,She could join him for a smoke,She could admonish him about smoking,She could take advantage of his smoke break to get ahead,She could slap the cigarette out of his mouth.,13.522,88.235,90.074,7,96,100,100,6,100,69,28,1,96,49,49,100,1,1,1,,38,Male,White / Caucasian,,Some College,Rung 2
100,1192,TRUE,R_2fwVwMaf4kF2Sv7,search for assistance programs to help,borrow money from a family member,get a payday loan,work extra hours to make the money,get a second job to make the money,5.884,100.971,101.433,2,40,100,81,82,100,100,30,81,50,80,100,100,50,100,100,,,,,,,,,,,,,,,,,,,,,,,,,get 500.75 from his bank account to replace it,tell the manager what happened and apologize,leave and never come back,try to figure out what happened to the missing money,blame the mistake on another employee,0.999,0.999,85.825,1,30,100,50,80,100,100,1,0,1,100,100,100,20,0,10,,,,,,,,,,,,,,,,,,,,,,,,,,,,,,,,,,,,,,,,,,,,,,,,,,,,,,,,,,,,,,,,,,,,,,,,,,,,,,,,,,,,,,,,,,,,,,,,,,,,,,,,,,,,,,,,,,,,,,,,,call Chuck's cell phone to see if it's him,call the police and report a reckless driver,stop his truck and let the driver continue on,flash his high-beams to get the attention of the driver,honk horn at the driver and signal to pull over,0.91,0.91,124.162,1,100,100,100,1,80,10,10,20,50,80,100,100,80,100,100,,,,,,,,,,,,,,,,,,,,,,,,,,,,,,,,,,,,,,,,,,,,,,,,,reschedule his flight and take the knife home,tell security and apologize and hope for no fine,try to conceal the knife and get through security undetected,throw the knife away in the trash before going through security,call someone to come pick up the knife,1.081,120.041,123.833,4,10,100,80,50,100,100,80,0,20,10,70,40,50,100,100,,,,,,,,,,,,,,,,,,,,,,,,,,,,,,,,,,,,,,,,,,,,,,,,,,,,,,,,,,,,,,,,,,,,,,,,,start walking right away to get help,keep trying to release his finger,try to find water nearby,cut his finger off to get it free,stay the night and hope someone finds them,1.601,60.527,100.813,3,90,100,100,80,100,100,1,50,10,1,1,1,10,50,10,wait for his boss to arrive at 7,call his boss and ask him to come in early,cancel his court appointment,walk off the job,call his boss and ask where he is,1.2,84.376,84.888,3,100,100,100,1,1,1,1,1,1,1,1,1,10,20,10,,,,,,,,,,,,,,,,,,,,,,,,,,41,Female,White / Caucasian,,College Graduate (4 year),Rung 4
100,598,TRUE,R_r1JQxoDdIpdduWR,,,,,,,,,,,,,,,,,,,,,,,,,,,,,,,,,,,,,,,,,,,,,,,,,Lie about being robbed.,Pay out of pocket for the difference.,Recount the money to make sure there's actually an error.,Take the risk of losing his job.,Distract the manager so they don't check the register.,1.131,1.131,56.279,1,2,1,2,25,99,37,99,100,100,44,56,62,7,4,9,Ask the manager to tell her friend.,Knock on windows until she draws her friend's attention.,Put on a disguise to get into the gym.,Abandon the gym and leave her friend wondering why she wasn't there.,Call the police.,7.62,7.62,62.039,1,58,99,97,5,8,3,3,16,3,51,22,69,1,25,1,,,,,,,,,,,,,,,,,,,,,,,,,Brad could go to the town.,Brad could choose to keep going the way they currently are.,Brad could kill himself.,Brad could eat one of his friends for food.,Brad could refuse to move further.,1.134,1.134,55.747,1,79,96,97,45,24,70,1,1,1,1,1,1,15,12,10,,,,,,,,,,,,,,,,,,,,,,,,,,,,,,,,,,,,,,,,,,,,,,,,,,,,,,,,,,,,,,,,,,,,,,,,,Tell the friend no.,Give the friend a ride.,Call an Uber for the friend.,Take the friend to his house.,Drive the friend a few miles closer.,2.793,2.793,49.014,1,20,50,51,50,50,50,30,94,68,9,94,26,39,81,62,,,,,,,,,,,,,,,,,,,,,,,,,,,,,,,,,,,,,,,,,,,,,,,,,,,,,,,,,,,,,,,,,,,,,,,,,,,,,,,,,,,,,,,,,,,,,,,,,Ahmed could give a pep talk.,Ahmed could encourage people to fight to the death.,Ahmed could like and say rescue isn't coming.,Ahmed could hog the food all to himself.,Ahmed could ration out the remaining food.,9.13,42.304,87.391,2,39,96,93,1,1,1,5,1,1,15,1,8,96,100,100,,,,,,,,,,,,,,,,,,,,,,,,,,,,,,,,,,,,,,,,,,,,,,,,,Stop to talk with the competitor.,Just keep on going with her race.,Taunt the competitor. ,Steal the competitor's dogs for her own use.,Smoke a cigarette with the competitor.,7.795,7.795,58.038,1,9,64,30,98,100,100,7,10,9,1,1,1,4,9,8,,31,Male,White / Caucasian,,Master's Degree (MS),Rung 5
