100,855,TRUE,R_3iFudAHBF8be3ce,,,,,,,,,,,,,,,,,,,,,,,,,,,,,,,,,,,,,,,,,,,,,,,,,,,,,,,,,,,,,,,,,,,,,,,,,,,,,,,,,,,,,,,,,,,,,,,,,,,,,,,,,,,,,,,,,,,,,,,,,Start following the river.,Try to find a place with internet connection.,Create a makeshift tent.,Kill wild animals.,Ration supplies. ,22.299,22.299,124.358,1,28,70,81,82,91,97,18,94,73,10,15,26,91,99,100,Find another activity to do.,Give him her ticket.,Try to sneak him in.,Find someone to buy the ticket from.,Try to rush back to get the ticket.,8.115,93.011,93.323,5,75,91,86,96,100,100,57,42,27,95,100,100,100,100,100,,,,,,,,,,,,,,,,,,,,,,,,,,,,,,,,,,,,,,,,,,,,,,,,,Call an uber for her.,Drive her where she needs to go.,Tell her to pay you to drive her.,Give her directions by bus.,Tell her you are busy.,13.509,16.014,98.809,4,88,80,89,87,88,93,11,17,11,28,82,60,75,95,94,Try to find the owner of the car.,Break open car window.,Call 911.,Call mall security.,Try to cool down the car. ,10.252,10.252,132.259,1,91,100,99,7,70,20,28,82,67,84,96,97,90,95,96,,,,,,,,,,,,,,,,,,,,,,,,,Try to call the taxi company to get it.,Buy another ring.,Borrow a ring.,Do it without a ring.,Replace ring with another item.,1.503,25.685,43.844,3,92,100,100,49,100,100,17,63,46,60,52,45,67,78,59,,,,,,,,,,,,,,,,,,,,,,,,,,,,,,,,,,,,,,,,,,,,,,,,,,,,,,,,,,,,,,,,,,,,,,,,,,,,,,,,,,,,,,,,,,,,,,,,,Ignore the situation.,Tell him to stop smoking.,Report the incident to officials.,Yell at the smoker.,Race past the smoker.,0.979,65.689,107.481,2,92,100,100,26,84,37,44,80,76,19,66,33,81,100,100,,28,Male,Asian / Pacific Islander,,College Graduate (4 year),Rung 6
100,681,TRUE,R_3PuhvfsRqFCbGHg,,,,,,,,,,,,,,,,,,,,,,,,,,,,,,,,,,,,,,,,,,,,,,,,,,,,,,,,,,,,,,,,,,,,,,,,,Ignore the situation,Call the gym and pay over the phone,Leave a message at the gym for her friend,Burn the gym down in retaliation,Beg and plead to get in,11.971,54.714,65.673,2,5,33,25,100,100,100,100,100,100,1,0,0,45,44,59,Redo her homework,Explain to the teacher about what happened,Steal someone else's homework and claim it for her own,Cry and plead for leniency,Don't worry about it.,11.465,11.465,87.671,1,70,100,100,100,100,100,7,0,0,5,18,6,75,100,100,,,,,,,,,,,,,,,,,,,,,,,,,,,,,,,,,,,,,,,,,,,,,,,,,,,,,,,,,,,,,,,,,,,,,,,,,Stay back,Verify the license plate,Call Chuck,Pull over,Call the police,7.792,7.792,35.418,1,100,100,100,64,87,89,100,100,100,7,52,50,3,48,49,,,,,,,,,,,,,,,,,,,,,,,,,Nothing,Talk to the dog through the window,Break the window even though it's not a hot day,Leave a nasty message under the wiper,Wait for the owner,8.502,8.502,61.876,1,100,100,100,80,85,88,0,0,0,0,0,0,4,11,1,,,,,,,,,,,,,,,,,,,,,,,,,,,,,,,,,,,,,,,,,,,,,,,,,Move his father in with him,Ignore his father's needs,Set up his father in a nursing home,Find someone to take care of him,Ask his father what he wants to do,13.349,49.269,94.052,2,70,100,100,0,0,0,94,98,99,64,100,100,65,100,100,,,,,,,,,,,,,,,,,,,,,,,,,,,,,,,,,,,,,,,,,,,,,,,,,,,,,,,,,,,,,,,,,,,,,,,,,Ask him for a cigarette,Leave the area,Scream at him that he's going to give her cancer,Ignore it,Throw snow at him,17.8,17.8,64.567,1,10,100,100,56,100,100,3,3,6,100,100,100,4,3,1,,58,Male,White / Caucasian,,High School or equivalent,Rung 4
100,869,TRUE,R_Zrald2CCVyMWSD7,,,,,,,,,,,,,,,,,,,,,,,,,,,,,,,,,,,,,,,,,,,,,,,,,He could leave it and not mention anything to his manager. ,He could apologize and explain to the manager whats going on.,He could stay late to try and track where the money is or how the balance is so short. ,He could tell the manager the register is balanced. ,"He could blame the last person on shift, ",35.256,130.801,139.297,8,71,7,32,81,97,75,77,98,91,35,6,17,24,3,5,She could pay her dues right then.,She could ask the employees to tell her friend she cant get in.,She could leave.,She could sneak in anyway.,She could go back to the office to gran the phone and call the friend.,13.976,49.806,64.081,8,88,95,96,79,96,85,45,67,58,16,7,10,49,75,61,,,,,,,,,,,,,,,,,,,,,,,,,He could discuss the problem with his friends and come up with their plan of action. ,He could act like nothings wrong. ,He could take the lead and decide how to get to the base.,He could let someone else decide what to do.,He could explain that they need to get back on route because of the food and weather conditions. ,13.051,80.934,106.159,18,99,99,97,14,39,38,70,85,83,84,89,71,93,99,95,,,,,,,,,,,,,,,,,,,,,,,,,,,,,,,,,,,,,,,,,,,,,,,,,He could flash his lights. ,He could pull up closer and see if its his friend.,He could call his friend. ,He could call the police. ,He could ignore the driver. ,22.38,57.722,63.888,7,81,88,77,83,69,76,69,83,85,58,89,73,86,35,75,,,,,,,,,,,,,,,,,,,,,,,,,She could break open the car window.,She could ignore it and walk away.,She could go back inside and report the car and dog inside. ,She could stand by the car until the owner comes back.,She could tell a stranger about it. ,5.15,52.67,59.076,7,14,38,17,85,16,64,90,98,79,36,69,46,57,36,43,,,,,,,,,,,,,,,,,,,,,,,,,He could quickly tell the groom he doesnt have it and apologize. ,He could blame someone else. ,He could leave and go try and find the ring. ,He could borrow a guests ring for the ceremony. ,He could pretend like he didnt know what happened. ,6.393,101.227,111.418,6,96,100,96,7,1,2,14,36,22,23,37,8,72,10,47,,,,,,,,,,,,,,,,,,,,,,,,,,,,,,,,,,,,,,,,,,,,,,,,,,,,,,,,,,,,,,,,,,,,,,,,,,,,,,,,,,,,,,,,,,,,,,,,,,,,,,,,,,,,,,,,,,,,,,,,,,29,Female,White / Caucasian,,College Graduate (4 year),Rung 6
100,2195,TRUE,R_DwAib3z0lXNy1Yl,,,,,,,,,,,,,,,,,,,,,,,,,Start walking toward civilization ,Cry out for help ,Keep trying his cell phone ,Take a nap in the car ,Start a fire and hope someone see smoke ,59.581,155.171,193.501,7,67,92,75,75,100,78,84,100,81,5,84,15,51,7,19,,,,,,,,,,,,,,,,,,,,,,,,,,,,,,,,,,,,,,,,,,,,,,,,,,,,,,,,,,,,,,,,,,,,,,,,,,,,,,,,,,,,,,,,,,,,,,,,,,,,,,,,,,,,,,,,,,,,,,,,,Call him out,Tell the family ,Do nothing ,Retrieve the things ,Call the police,8.46,23.595,27.9,6,58,42,57,72,89,85,32,15,57,30,100,31,31,44,41,Flip him off,Run him off the road,Ignore him,Call him on the phone,Do nothint,15.895,40.464,45.963,8,47,31,44,17,7,6,64,82,76,40,89,86,81,75,75,Keep going ,Complain to his friend ,Dump his friend off,Turn around and say nothing,Ask his friend for gas money,10.808,90.378,95.658,7,100,100,100,69,47,72,10,20,16,17,8,9,17,10,19,,,,,,,,,,,,,,,,,,,,,,,,,,,,,,,,,,,,,,,,,,,,,,,,,Confess his mistake ,Stop and get a replacement fast,Show up without the ring,Make a ring out of paper towels ,Keep searching ,7.181,220.533,224.064,8,81,100,83,53,100,82,71,91,100,12,11,78,85,100,100,,,,,,,,,,,,,,,,,,,,,,,,,,,,,,,,,,,,,,,,,,,,,,,,,Leave and find help,Cry out for help ,Pulling on Todds legs,Chiseling the rocks away,Cutting Todds finger off,113.232,299.521,325.356,9,100,82,89,75,100,100,68,71,71,56,95,40,16,67,10,,,,,,,,,,,,,,,,,,,,,,,,,,,,,,,,,,,,,,,,,,,,,,,,,,40,Male,White / Caucasian,,College Graduate (4 year),Rung 7
100,832,TRUE,R_2Tv2e50jbgsvKna,Reassess their budget,Contact various vets about payment plans or free work they offer.,Solidify a monetary goal and any alternate options.,Pick a plan.,Work towards the plan.,5.516,129.123,148.891,6,75,100,100,50,100,100,50,100,100,90,100,100,90,100,100,,,,,,,,,,,,,,,,,,,,,,,,,,,,,,,,,,,,,,,,,,,,,,,,,,,,,,,,,,,,,,,,,,,,,,,,,,,,,,,,,,,,,,,,,,,,,,,,,Stop and assess the situation rationally.,Account for what the group has on their persons.,Take account of what is in their immediate surroundings that could be useful.,Remain calm.,Create a plan.,1.327,1.327,72.745,1,90,100,100,75,100,100,25,100,100,50,100,100,90,100,100,,,,,,,,,,,,,,,,,,,,,,,,,,,,,,,,,,,,,,,,,,,,,,,,,Give the vehicle a safe distance as to avoid any accidents.,Confirm whether the car is driven by their friend.,Discourage the behavior if it is their friend.,Call authorities if it is not their friend as it may be an emergency situation.,"Alert other drivers to the dangerous driving (use hazards, etc). ",0.849,0.849,98.592,1,75,100,100,100,100,100,50,100,100,50,100,100,50,100,100,,,,,,,,,,,,,,,,,,,,,,,,,,,,,,,,,,,,,,,,,,,,,,,,,Decide if they want to remove themselves from the line or not.,Declare possession of the item.,Deal with consequences of the mistake.,Adjust travel plans as dictated by the outcome of the mistake.,Learn a lesson.,11.155,56.389,85.018,3,100,100,100,75,100,100,75,100,100,90,100,100,50,100,100,,,,,,,,,,,,,,,,,,,,,,,,,,,,,,,,,,,,,,,,,,,,,,,,,Gather crew to assess the situation.,Take stock of their reserves.,Create a rationing plan.,Keep in contact with rescuers.,Keep passengers calm and updated.,15.051,15.051,55.973,1,90,100,100,90,100,100,75,100,100,100,100,100,75,100,100,"Stop and assess the situation, take a breath.",Take stock of what the pair has on their persons.,Take stock of their immediate surroundings looking for anything useful.,Consider all avenues to rescue for both.,Act on a plan.,1.075,1.075,104.309,1,75,100,100,75,100,100,50,100,100,50,100,100,90,100,100,,,,,,,,,,,,,,,,,,,,,,,,,,,,,,,,,,,,,,,,,,,,,,,,,,38,Male,White / Caucasian,,High School or equivalent,Rung 2
100,3866,TRUE,R_1hHiUhSncMYNhgl,Try to get financial assistance,Ask someone for a loan,Try to get a different medication,Steal the medication,Set up a GoFundMe,6.269,6.269,55.43,1,52,100,100,54,90,65,72,100,84,7,0,1,41,77,66,,,,,,,,,,,,,,,,,,,,,,,,,,,,,,,,,,,,,,,,,,,,,,,,,,,,,,,,,,,,,,,,,,,,,,,,,Explain to the professor,Try to re-do it quickly,Do nothing,Ask a classmate for help,Ask for an extension,8.826,8.826,46.75,1,100,100,100,49,100,100,51,32,30,42,10,29,68,100,80,,,,,,,,,,,,,,,,,,,,,,,,,,,,,,,,,,,,,,,,,,,,,,,,,Stop the teenager and question him,Ignore the situation and do nothing,Try to find the family to let them know,Go get the things out of the ocean,Punch the teenager,1.529,3.083,34.79,2,66,100,100,51,43,73,66,100,90,6,38,4,0,0,0,,,,,,,,,,,,,,,,,,,,,,,,,,,,,,,,,,,,,,,,,,,,,,,,,Go get police to help,Get firemen to help,Break the window of the car,Keep going and ignore the situation,Break into the car,3.109,3.109,17.554,1,97,100,81,100,84,89,5,12,7,38,1,9,1,1,1,,,,,,,,,,,,,,,,,,,,,,,,,,,,,,,,,,,,,,,,,,,,,,,,,Invite his father to live with him,Pay for home healthcare for his dad,Put his dad in a rest home,Do nothing to help,Give his dad money to support himself,1.328,13.559,31.377,2,8,100,28,78,100,90,38,22,31,27,1,4,68,100,76,Ration out supplies that are left,hoard all the supplies for himself,Lie about how much they have left,go on and eat them all now,let everyone know that supplies are on the way,330.209,330.209,417.463,1,100,100,100,4,0,1,3,0,2,1,0,1,100,100,100,,,,,,,,,,,,,,,,,,,,,,,,,,,,,,,,,,,,,,,,,,,,,,,,,,,,,,,,,,,,,,,,,,,,,,,,,,41,Female,White / Caucasian,,Master's Degree (MS),Rung 3
100,3902,TRUE,R_1Nn6yopPtIFs1sJ,Ask a friend or family member to loan you the money,Take out an actual loan,Sell some of your more expensive things on the internet,Don't buy the medicine and hope for the best,Put the dog down,16.787,89.683,137.222,4,85,68,88,49,93,31,43,86,92,1,1,20,1,1,1,,,,,,,,,,,,,,,,,,,,,,,,,,,,,,,,,,,,,,,,,,,,,,,,,,,,,,,,,,,,,,,,,,,,,,,,,,,,,,,,,,,,,,,,,,,,,,,,,,,,,,,,,,,,,,,,,,,,,,,,,,,,,,,,,,,,,,,,,,,,,,,,,Approach him and ask if something is wrong,Go ask another family member about it,Ask him what he's doing,Wait til someone else notices him,Ignore him,8.388,134.079,170.782,9,74,100,65,100,51,78,41,37,65,28,30,97,2,0,42,,,,,,,,,,,,,,,,,,,,,,,,,,,,,,,,,,,,,,,,,,,,,,,,,Approach the car to see the cute dog up close,"Say ""Aww, so cute"" while walking past",Ask around to try and find his owner,Call the police,Break the window and free the dog,0.654,106.777,155.354,9,72,50,90,90,50,100,2,45,0,1,20,0,0,0,2,,,,,,,,,,,,,,,,,,,,,,,,,,,,,,,,,,,,,,,,,,,,,,,,,Let his father move in with him for the time being so that he can grieve without worrying about bills.,Help his father find a job so that he can get his own place.,Let his father stay over for a couple days until he gets back on his feet,Put his father in a retirement home,Let his father fend for himself.,0.93,85.24,204.201,2,94,100,89,2,23,49,5,24,64,2,1,2,1,1,1,Don't tell the passengers or the crew. Mass panic will not help anthing.,Tell the members of the crew that he trusts.,Announce the situation to the passengers and crew over the intercoms.,Order kitchen staff to reduce the amount of food given to each passenger,Stop passengers from buying food. Announce that there is a complication and their food will be brought to them.,2303.72,2303.72,2539.554,1,49,49,33,90,77,85,10,50,25,8,50,7,1,29,1,,,,,,,,,,,,,,,,,,,,,,,,,,,,,,,,,,,,,,,,,,,,,,,,,Ask him if he's hurt,Keep going; someone else will take care of it,"Win the race, then come back for him immediately after","Win the race, then tell an official",Visibly laugh at him as you pass him,0.858,251.812,259.711,8,40,98,30,10,21,77,82,50,34,19,40,85,0,0,5,,24,Female,White / Caucasian,,Some College,Rung 3
100,747,TRUE,R_2zIPubwkc40S6tR,,,,,,,,,,,,,,,,,,,,,,,,,,,,,,,,,,,,,,,,,,,,,,,,,,,,,,,,,,,,,,,,,,,,,,,,,,,,,,,,,,,,,,,,,,,,,,,,,Tell the teacher,Skip class,Quickly redo the assignment,Say or do nothing,Steal someone else's homework,8.205,8.205,55.495,1,100,100,100,35,45,64,70,100,93,91,94,95,2,2,2,,,,,,,,,,,,,,,,,,,,,,,,,,,,,,,,,,,,,,,,,,,,,,,,,Ask the teenager to stop,Go inform the family,Call the cops,Grab their stuff from the water,Go sit with their stuff so he can't grab more,12.671,58.92,107.541,6,99,100,100,100,100,100,24,22,18,36,34,36,22,22,24,,,,,,,,,,,,,,,,,,,,,,,,,,,,,,,,,,,,,,,,,,,,,,,,,,,,,,,,,,,,,,,,,,,,,,,,,,,,,,,,,,,,,,,,,,,,,,,,,Leave the wedding,Go buy a new ring quickly,Call the taxi company,Continue as the ring bearer with no ring,Borrow someone's ring until he can get the original,1.592,11.228,59.867,2,26,1,14,2,92,3,100,100,100,62,60,63,20,61,15,Put his father in nursing home,Hire home health aide,Leave his father where he is,Have father move in with him,Move in with his father,12.095,25.362,49.075,2,56,59,83,72,75,85,1,1,1,97,100,98,10,100,67,,,,,,,,,,,,,,,,,,,,,,,,,,,,,,,,,,,,,,,,,,,,,,,,,Wait until 7am to see if boss shows up,Call the boss now,Leave work without the boss being there,Call the court and inform them,Ask another coworker to come in,3.754,3.754,56.669,1,97,100,100,81,94,94,2,4,4,89,100,92,43,98,97,Continue on with the race,Ask him if he's okay,Have a cigarette with him,Tell him to stop smoking,Quit the race,9.024,9.024,61.441,1,100,100,100,86,100,100,18,40,17,10,29,6,1,1,2,,21,Female,White / Caucasian,,Some College,Rung 6
100,1898,TRUE,R_22xGOKWZLrhrP9p,,,,,,,,,,,,,,,,,,,,,,,,,,,,,,,,,,,,,,,,,,,,,,,,,double check all of the receipts,go to a nearby ATM and take the money out of his account,tell his boss that the money is missing and he is working to resolve it,contact other co-workers to see if they know anything,quick lock up the bakery and leave before the boss gets there,29.513,29.513,180.786,1,76,100,100,29,100,10,50,100,60,50,100,100,51,7,13,ask to borrow someone's phone,use the phone at the gym to call,wait outside for her friend,ask the gym staff if her friend is already there,leave and explain later to her friend what happened,287.872,287.872,374.126,1,50,100,91,55,100,100,81,100,100,82,95,94,19,90,50,,,,,,,,,,,,,,,,,,,,,,,,,,,,,,,,,,,,,,,,,,,,,,,,,give Ted her ticket and go back to get his ticket,try to talk to security to see if they will let Ted in,try to sneak Ted in,tell Ted to go back to his house and get the ticket,try to buy someone else's ticket at the door for a higher price,32.69,32.69,131.274,1,50,100,61,81,100,86,30,3,41,15,100,20,70,100,89,,,,,,,,,,,,,,,,,,,,,,,,,,,,,,,,,,,,,,,,,,,,,,,,,tell her he has another commitment and can't do it,he could take her,tell her it is really out of his way and can't take her,offer to take her part of the way and see if she can get a ride for the rest,tell her his wife would not appreciate it,16.468,39.427,144.27,3,81,100,100,50,100,70,35,100,83,57,100,82,85,100,100,keep walking to her car and leave,stop by the car to see if the dog looks ok and then leave,"stop by the car to and if the dog doesn't seem ok, go back into the mall",call the police,break a window in the car and let the dog out,17.336,54.201,98.317,2,85,100,100,73,100,93,68,100,86,8,29,3,2,2,1,,,,,,,,,,,,,,,,,,,,,,,,,,,,,,,,,,,,,,,,,,,,,,,,,,,,,,,,,,,,,,,,,,,,,,,,,,,,,,,,,,,,,,,,,,,,,,,,,,,,,,,,,,,,,,,,,,,,,,,,,call his boss to make sure he is coming at 7am,wait until 6:30am to call his boss ,leave at 7am whether his boss is there or not,call another employee to see if they can come in,cancel his court appointment,29.903,29.903,206.378,1,40,100,75,91,100,100,50,50,24,27,90,83,5,3,3,,,,,,,,,,,,,,,,,,,,,,,,,,53,Female,Other,white/Native Alaskan,High School or equivalent,Rung 4
100,1097,TRUE,R_0TdXfxFeja9XlVD,,,,,,,,,,,,,,,,,,,,,,,,,Start walking to get to the airport.,Hitchhike.,Try to flag a driver down to call a tow truck for him.,Try to work on his car himself.,Walk to the nearest business and call for help.,1.264,18.672,99.881,2,3,100,54,16,66,46,89,100,100,43,100,100,100,100,100,Tell his manager that he was robbed.,Make up a story about how he was short changed.,Run a post void on the register to account for the money.,Just be honest with manager and hope the mistake is found.,Quit and leave.,1.475,120.959,189.378,2,0,0,0,54,0,2,50,0,17,100,100,90,50,24,56,Leave and go back to her office to get her phone. ,Scream until someone hears her and gets her friend.,Ask a passerby to text her friend for her.,Ask to speak to a manager.,Try to sneak in.,1.817,1.817,75.432,1,100,100,100,3,20,5,52,100,94,55,100,100,0,0,6,Go home sick.,Talk to the teacher and show the mess.,Make up a lie about what happened.,Skip class.,Try to make up new homework and show up for class late.,1.48,1.48,82.845,1,100,32,90,100,100,100,50,0,32,51,15,14,51,100,85,,,,,,,,,,,,,,,,,,,,,,,,,,,,,,,,,,,,,,,,,,,,,,,,,,,,,,,,,,,,,,,,,,,,,,,,,,,,,,,,,,,,,,,,,,,,,,,,,,,,,,,,,,,,,,,,,,,,,,,,,Call the humane shelter for help. ,Call the police to come.,Break the window herself.,Write down the licence plate and go back into the mall for help.,Tell a passerby who can deal with the problem instead of her.,11.091,11.091,90.338,1,90,100,100,41,100,100,6,61,46,87,100,100,44,51,100,,,,,,,,,,,,,,,,,,,,,,,,,,,,,,,,,,,,,,,,,,,,,,,,,,,,,,,,,,,,,,,,,,,,,,,,,,,,,,,,,,,,,,,,,,,,,,,,,,,,,,,,,,,,,,,,,,,,,,,,,Leave and lock the store.,Work over until he finds help.,Call a friend to watch the store for him.,Call another employee in.,Quit his job and leave.,23.718,23.718,100.618,1,92,100,92,51,100,100,40,65,30,100,100,100,51,70,26,,,,,,,,,,,,,,,,,,,,,,,,,,40,Female,White / Caucasian,,High School or equivalent,Rung 3
100,566,TRUE,R_2ckmkNKQPIJmMAx,,,,,,,,,,,,,,,,,,,,,,,,, Eunice Shriver thoroughly terrified her husband's biographer,No, It's Friday night in a small plane bound for Allentown,Eunice Kennedy Shriver is asking questions. She wants to know about Jane ,No,1.024,1.024,32.448,1,75,96,87,89,78,95,79,100,95,92,83,100,93,90,98,,,,,,,,,,,,,,,,,,,,,,,,,,,,,,,,,,,,,,,,,,,,,,,,,,,,,,,,,,,,,,,,,,,,,,,,,Eunice Mary Kennedy Shriver DSG,No,No,No,No,0.293,21.381,27.38,4,89,83,96,95,100,97,99,82,86,90,80,92,87,95,92,,,,,,,,,,,,,,,,,,,,,,,,,Eunice Kennedy Shriver believed that people , with disabilities could play sports while others didn't even want to believe it. ,Eunice Kennedy Shriver believed that if people with intellectual disabilities were given the same opportunities,No,No,37.83,73.116,164.627,3,73,93,85,88,97,93,96,81,87,82,95,89,83,97,92,,,,,,,,,,,,,,,,,,,,,,,,,Wind that strong will sweep people and vehicles off street,No,NA,"If confirmed, it will beat the previous record","Because of their small size sting jets are notoriously hard to predict, but scientists believe",40.513,40.513,68.845,1,80,100,90,92,85,94,99,90,95,78,99,95,89,100,94,,,,,,,,,,,,,,,,,,,,,,,,,,,,,,,,,,,,,,,,,,,,,,,,,,,,,,,,,,,,,,,,,,,,,,,,," Inspired by her love of God, her devotion to her family","Storm Eunice is battering parts of the UK, felling trees and scattering ", Wind that strong will sweep people and vehicles off streets," Will Lang, head of the service, tells Radio 1 Newsbeat",We're all aware of some of the severe weather that has been witnessed across Europe,11.389,11.389,46.333,1,69,92,97,97,84,90,90,100,96,88,100,95,79,94,88,Very excited to this survey.,The survey is very likely.,No,Very honest to this survey.,No,0,0,34.72,0,76,91,85,77,94,88,87,97,91,94,84,89,84,97,98,,,,,,,,,,,,,,,,,,,,,,,,,,,,,,,,,,,,,,,,,,,,,,,,,,,,,,,,,,,,,,,,,,,,,,,,,,37,Female,White / Caucasian,,Doctoral Degree (PhD),Rung 9
100,1054,TRUE,R_2VpvsdJlQeyQF5O,Buy the needed medication in Mexico.,Ask a friend to help out.,Rehome his dog to someone who can afford the medicine. ,Take good care of his dog and enjoy the little time they have left together.,Borrow money to get the dog medication.,18.626,91.376,104.049,5,15,85,17,52,76,92,23,93,48,92,75,93,32,82,83,Walk to an area with Cell service.,Sit and wait and hope someone drives by to help.,"Just give up, he is not going to make his flight.",Hitchhike to the airport and leave his car behind.,Hitchhike to a place with cell phone coverage and call to get his car towed.,16.974,131.25,136.472,11,52,100,100,71,92,95,27,62,43,20,20,21,87,97,98,Tell the manager the money is missing and ask for help figuring it out.,Put his own money into the till to make the day balance.,Look for mistakes and over rings to see if it was a clerical error.,Blame another employee.,Quit his job when the manager arrives.,15.936,95.071,110.551,8,79,96,96,14,14,14,73,95,96,25,7,52,8,52,10,,,,,,,,,,,,,,,,,,,,,,,,,,,,,,,,,,,,,,,,,,,,,,,,,Try to find the town and hike there.,Send one person to get help while the rest of the party waits in one spot.,Ration food/water until they can find a way to the town.,Stay put and hope to be rescued.,Split into two groups with the healthiest going to look for the town.,15.959,118.446,141.83,8,77,78,79,52,76,76,60,86,86,23,24,24,53,81,82,,,,,,,,,,,,,,,,,,,,,,,,,,,,,,,,,,,,,,,,,,,,,,,,,Pull up next to the car to see if it is his friend.,Flash his headlights to get the drivers attention and stop him from driving erratically.,Call 911 and report a dangerous driver.,Call Chuck on the phone and see if it is him.,Just keep driving and ignore the other drivers bad behavior.,14.321,93.753,111.688,5,87,88,87,72,85,85,42,52,28,86,86,87,32,23,53,,,,,,,,,,,,,,,,,,,,,,,,,,,,,,,,,,,,,,,,,,,,,,,,,,,,,,,,,,,,,,,,,,,,,,,,,,,,,,,,,,,,,,,,,,,,,,,,,,,,,,,,,,,,,,,,,,,,,,,,,,,,,,,,,,,,,,,,,,,,,,,,,Hike to an area with cell signal and get help.,Get Todd as much water as you have.,Yell for other hikers to help.,Cut off his finger and head back to the trail head.,Leave him behind and run for help.,17.012,83.644,98.94,5,87,94,95,67,98,99,72,98,98,4,5,6,37,34,36,,,,,,,,,,,,,,,,,,,,,,,,,,,,,,,,,,,,,,,,,,,,,,,,,,61,Female,White / Caucasian,,Some College,Rung 3
100,2460,TRUE,R_3E2c2u4mL76Iw4F,,,,,,,,,,,,,,,,,,,,,,,,,,,,,,,,,,,,,,,,,,,,,,,,,,,,,,,,,,,,,,,,,,,,,,,,,,,,,,,,,,,,,,,,,,,,,,,,,,,,,,,,,,,,,,,,,,,,,,,,,,,,,,,,,,,,,,,,,,,,,,,,,,,,,,,,,,,,,,,,,,,,,,,,,Ask the teenager if he's part of the family.,Ask the family members if the teenager's a part of their family.,Ask the teenager why he's doing that.,Ask the family why he's doing that.,Tell a lifeguard what the teenager is doing.,161.107,161.107,249.912,1,100,100,100,100,100,100,100,100,100,100,100,100,52,100,100,,,,,,,,,,,,,,,,,,,,,,,,,Give her a ride.,Let her know that he can only drop her off so far.,Tell her that he wishes he could but he can't.,Ask a friend to give a ride to her.,Ask a relative if they can give her a ride.,1.599,1.599,74.613,1,100,100,100,34,100,100,45,100,100,22,53,28,51,76,86,,,,,,,,,,,,,,,,,,,,,,,,,,,,,,,,,,,,,,,,,,,,,,,,,Call the taxi and ask them to come back so he can look for his ring in the cab.,Call the taxi cab to ask if they can find the ring for him and bring it back if so.,Ask a friend to go out and find the cab to find the ring for him.,Ask a relative to go out and find the cab to find the ring for him.,Ask a relative to find a temporary replacement ring as before the wedding starts.,2.002,2.002,68.398,1,100,100,100,100,100,100,100,100,100,100,100,100,100,100,100,,,,,,,,,,,,,,,,,,,,,,,,,,,,,,,,,,,,,,,,,,,,,,,,,Keep trying to get a signal for the phone.,Go out and look for anyone nearby or within a few miles of their location.,Shoot up a flare signal.,Think about possible having to cut off Todd's finger.,Find some water to hydrate first and foremost before doing anything.,1476.695,1476.695,1564.965,1,100,100,100,100,100,100,100,100,100,43,100,100,100,100,100,Call his boss to see what's going on and when he's coming in.,Ask one of his coworkers to call his boss.,Leave a message on his boss's voicemail.,Text his boss to let him know what's going on.,Ask a coworkers if they can cover his shift.,1.298,33.176,78.465,2,100,100,100,61,100,100,100,100,100,100,100,100,78,100,100,Ignore it and keep going through the race to win.,Ask them why they're smoking.,Ask them for a cigarette to have a smoke break.,Ask them if they care about winning the money or not.,Ask them why in God's name are they stopping.,5.31,5.31,79.622,1,100,100,100,41,100,100,8,100,100,51,100,100,62,100,100,,33,Female,Hispanic / Latino,,Some College,Rung 5
