100,785,TRUE,R_djcf0iJnKXVFmKt,,,,,,,,,,,,,,,,,,,,,,,,,,,,,,,,,,,,,,,,,,,,,,,,,run the numbers again,review who had access to the cash,cover the shortfall out of his pocket,be honest with his manager,ask his manager for help,0,0,97.697,0,100,100,100,100,100,100,50,100,52,91,100,100,91,100,100,,,,,,,,,,,,,,,,,,,,,,,,,tell teacher the truth,redo homework before class,show up late,skip class altogether,copy a friends homework,11.332,54.405,87.494,3,75,100,100,92,100,100,42,96,96,59,97,100,13,14,33,,,,,,,,,,,,,,,,,,,,,,,,,,,,,,,,,,,,,,,,,,,,,,,,,ask teen what he's doing,yell STOP,tackle teen,fight teen,do nothing,19.748,33.636,54.573,3,79,100,100,41,100,100,5,14,12,6,4,4,52,90,74,,,,,,,,,,,,,,,,,,,,,,,,,,,,,,,,,,,,,,,,,,,,,,,,,,,,,,,,,,,,,,,,,,,,,,,,,throw the knife away,go back to his car,put the knife in amnesty box,go to fedex and mail himself the knife,go home,12.427,75.254,99.67,4,28,100,62,68,100,100,20,100,36,72,100,100,7,100,76,tell the truth to everyone,run away,apologize to sister,apologize to guests,apologize to new brother-in-law,2.275,2.275,46.508,1,88,100,97,9,9,20,84,100,100,83,100,100,82,100,100,invite dad to stay with him,move into dad's house,hire somebody close to watch dad,hire a stranger to watch dad,do nothing,0,0,61.675,0,64,100,100,31,100,100,93,100,100,52,98,99,14,20,44,,,,,,,,,,,,,,,,,,,,,,,,,,,,,,,,,,,,,,,,,,,,,,,,,,,,,,,,,,,,,,,,,,,,,,,,,,,,,,,,,,,,,,,,,,,,,,,,,,47,Male,Other,mixed,Some College,Rung 10 (Top Rung)
100,1911,TRUE,R_2VEM3RdkdzTWSbF,,,,,,,,,,,,,,,,,,,,,,,,,,,,,,,,,,,,,,,,,,,,,,,,,,,,,,,,,,,,,,,,,,,,,,,,,Sneak in,Go back to get her phone to let her friend know,Pay her bill so she can get in,Ask to use someone's phone,Ask someone who is going in to tell her friend what happened for her,9.662,16.262,78.561,2,9,5,10,82,100,92,80,100,88,60,90,83,60,96,83,Tell and show her teacher what happened,Skip class,Just accept she can't turn it in,Make up an excuse on why she can't turn it in,Lie and say she turned it in and that the teacher must have lost it,18.937,32.498,95.964,3,82,100,92,40,50,50,70,100,78,56,10,70,20,2,20,,,,,,,,,,,,,,,,,,,,,,,,,Give him her ticket,Tell him to go get his ticket and come back,"Go in, and then meet Ted somewhere and give him her ticket so he can get in",Distract the security so he can sneak in,Tell Ted they can go do something else,11.654,68.043,133.323,2,50,100,61,30,100,71,40,30,70,25,20,27,30,100,88,,,,,,,,,,,,,,,,,,,,,,,,,Call Chuck (hands free of course) and make sure he's okay,Call the police,Speed up and get a little closer to see if he can see what's going on,Honk at the car to get their attention,Slow down just to be safe,238.802,238.802,314.348,1,63,50,82,30,80,72,40,75,63,61,83,92,71,93,94,,,,,,,,,,,,,,,,,,,,,,,,,,,,,,,,,,,,,,,,,,,,,,,,,Get out of line and get one of those lockers to put it in until he returns,Hope they don't see it,Throw it away,Just face the consequences and pay the fine,Go home and put it away and come back,10.16,10.16,88.101,1,71,100,95,30,61,31,9,91,50,71,96,71,40,100,70,,,,,,,,,,,,,,,,,,,,,,,,,,,,,,,,,,,,,,,,,,,,,,,,,,,,,,,,,,,,,,,,,,,,,,,,,She can cut Todd's finger off,"Find a stick or something that fits in the crevice, and use her body weight as leverage to try to make the opening large enough to  get the finger out",She can leave to go find help,"Find a rock that's a little too big to fit into the crevice, and try to hammer it into the crevice with another rock to widen it enough",Wait with Todd until someone else comes along,0.443,251.604,280.988,7,3,15,8,34,92,75,50,82,83,46,94,86,68,90,92,,,,,,,,,,,,,,,,,,,,,,,,,,,,,,,,,,,,,,,,,,,,,,,,,,29,Male,Asian / Pacific Islander,,College Graduate (4 year),Rung 4
100,1230,TRUE,R_2UeYJn7dxZ32ufz,take out a loan,work alot of extra hours,steal the medication,start robbing people,not get the medication,75.545,118.549,119.492,2,100,100,100,80,100,100,10,1,2,1,1,1,20,5,5,,,,,,,,,,,,,,,,,,,,,,,,,steal it from another register,just admit that he doesnt know what happened,say he got robbed,accuse the manager of stealing it,quit,155.227,200.274,200.58,2,20,1,1,100,100,100,15,1,1,20,2,25,50,30,100,,,,,,,,,,,,,,,,,,,,,,,,,,,,,,,,,,,,,,,,,,,,,,,,,Try to walk to the town,Yell for help,Ration their food,Try to build a fire,Return to their planned route,37.024,93.114,93.699,3,100,100,100,100,100,100,80,100,100,100,100,100,50,50,100,return to get the ticket,sneak in,scream at the staff to let him in,steal daryas ticket and leave her outside,just not go,157.448,177.918,241.643,3,100,100,100,40,5,20,1,1,1,1,1,2,100,100,100,,,,,,,,,,,,,,,,,,,,,,,,,,,,,,,,,,,,,,,,,,,,,,,,,,,,,,,,,,,,,,,,,,,,,,,,,Smash the window,Call the police,find the owner,leave,start screaming until the owner arrives,100.746,101.001,139.02,2,40,30,45,100,100,100,100,100,100,50,15,100,18,100,10,,,,,,,,,,,,,,,,,,,,,,,,,,,,,,,,,,,,,,,,,,,,,,,,,,,,,,,,,,,,,,,,,,,,,,,,,,,,,,,,,,,,,,,,,,,,,,,,,,,,,,,,,,,,,,,,,,,,,,,,,Just wait,Skip court,lock the doors and go anyways,Call the boss and ask when he will be there,Quit,78.395,80.849,118.952,2,100,100,100,30,5,50,60,40,80,100,100,100,5,50,50,,,,,,,,,,,,,,,,,,,,,,,,,,36,Male,White / Caucasian,,Some College,Rung 5
100,1982,TRUE,R_UoNaR6jF3NmfLMt,,,,,,,,,,,,,,,,,,,,,,,,,Ask lift to somebody  and tell to drop in the airport,He try to resolve the car  issue in its own,inform to hire official to this situation ,ask help for friend are some one through mobile,Call to the mechanic or car service center and wait when they will come make to ready the car,3.245,240.208,273.538,19,66,79,74,64,71,71,71,80,75,73,77,77,60,74,76,,,,,,,,,,,,,,,,,,,,,,,,,,,,,,,,,,,,,,,,,,,,,,,,,,,,,,,,,,,,,,,,,,,,,,,,,,,,,,,,,,,,,,,,,,,,,,,,,Asking to others to get ticket,Go to the ticket counter to get the ticket,search in online if ticket is possible,No way return to home and take a ticket,Compramise all guys get back and go somewhere and enjoyed a lot,3.337,56.547,181.381,2,39,53,51,58,65,68,75,68,77,84,77,92,66,73,65,,,,,,,,,,,,,,,,,,,,,,,,,,,,,,,,,,,,,,,,,,,,,,,,,,,,,,,,,,,,,,,,,,,,,,,,,try call the car owner and release the dog,not take any response go further,Inform to security for help to release the dog,Inform to mall worker to intimate the dog owner,say hi and shake hands then go,3.224,198.679,255.861,6,79,73,83,27,34,31,63,80,75,74,72,83,34,49,50,He get back to the airboard,He will through in to the dustbin if possible,inform to security team the purpose of the knife,Getting the fine amount and pay,No way he should punish him,28.574,337.862,389.988,16,68,64,72,46,59,55,41,62,62,55,66,70,61,73,62,,,,,,,,,,,,,,,,,,,,,,,,,She will move to their relations home,she will take decision to stay in hostal,she make it herself to take care in its own,inform to her father and to appoint one home taker,Her father try to take care of his child,3.082,169.808,230.084,6,60,72,68,66,82,76,54,66,63,62,74,64,64,81,76,,,,,,,,,,,,,,,,,,,,,,,,,Ask loudly to get help,Try to giving some water for todd,Try 911 more time to get emergency service,Help to todd to release his finger,Think similarly and make good decison to resolve the issue,6.341,290.987,326.526,9,58,66,70,66,74,72,70,81,77,68,80,76,68,81,78,,,,,,,,,,,,,,,,,,,,,,,,,,,,,,,,,,,,,,,,,,,,,,,,,,42,Female,White / Caucasian,,College Graduate (4 year),Rung 6
100,2143,TRUE,R_C2I1YcruS2Sokyl,Skip getting the medication and let nature take its course,Use GoFundMe,Borrow the money from friends and family,Have a bake sale,Bargain with the vet,42.888,42.888,184.072,1,16,29,25,27,63,75,64,83,89,20,91,55,41,95,48,,,,,,,,,,,,,,,,,,,,,,,,,Count the money again,Put 500.75 of his own money in the register,Talk with his team about the missing money,Talk with his manager about the missing money,Run,14.793,14.793,71.082,1,100,100,100,0,73,0,50,100,100,90,100,100,2,1,1,,,,,,,,,,,,,,,,,,,,,,,,,,,,,,,,,,,,,,,,,,,,,,,,,,,,,,,,,,,,,,,,,,,,,,,,,,,,,,,,,,,,,,,,,,,,,,,,,,,,,,,,,,,,,,,,,,,,,,,,,Honk his horn to get the driver's attention,Call the police,Call his friend,Make a pass,Exit the road.,93.876,93.876,151.484,1,95,100,98,4,16,11,77,71,92,95,87,93,12,96,93,,,,,,,,,,,,,,,,,,,,,,,,,,,,,,,,,,,,,,,,,,,,,,,,,Stay in line and deny knowledge of the knife,Get out of line and dispose of the knife,Get out of line and hide the knife for later retrieval,Stay in line and say it was a gift and a tool for his job.,Run.,10.673,771.499,808.376,4,81,74,84,34,74,62,62,68,72,85,54,98,1,1,1,Call the taxi company,Panic and do nothing,Substitute his own ring,Call the police,Run,1.971,1.971,465.948,1,100,100,100,7,0,1,6,4,2,50,97,91,1,1,0,,,,,,,,,,,,,,,,,,,,,,,,,,,,,,,,,,,,,,,,,,,,,,,,,Yell for help,Cut off Todd's finger,Go get help despite being dehydrated,Walk until a signal is found,Keep trying to remove Todd's finger,12.954,12.954,111.815,1,94,100,100,9,71,14,81,95,98,75,98,97,98,100,100,,,,,,,,,,,,,,,,,,,,,,,,,,,,,,,,,,,,,,,,,,,,,,,,,,54,Male,White / Caucasian,,College Graduate (4 year),Rung 7
100,930,TRUE,R_2YhuBgFoUk9KUWr,,,,,,,,,,,,,,,,,,,,,,,,,Hitchhike for a ride,Run to the airport,Sleep,Give up,Attempt to fix the car,0.701,85.117,98.128,35,65,56,47,42,76,52,34,86,71,11,37,48,80,94,87,,,,,,,,,,,,,,,,,,,,,,,,,,,,,,,,,,,,,,,,,,,,,,,,,,,,,,,,,,,,,,,,,,,,,,,,,,,,,,,,,,,,,,,,,,,,,,,,,,,,,,,,,,,,,,,,,,,,,,,,,,,,,,,,,,,,,,,,,,,,,,,,,Honk at the car,Call Chuck to confirm it is him,Cut off the car,Slow down,Get off the road,0.72,45.543,51.215,29,60,30,57,65,87,74,40,8,19,81,96,89,82,95,93,Give a ride,Make an excuse,Ask the friend to pay for gas,Help them get as far as Cameron's house,Say no,0.968,52.018,59.731,33,85,94,95,63,43,52,43,27,30,41,12,13,20,14,19,,,,,,,,,,,,,,,,,,,,,,,,,Be truthful,Throw the knife away,Attempt to sneak the knife through,Pretend the knife is not there,Lie and say he was framed,0.692,69.72,126.044,33,95,99,94,62,28,47,30,3,23,12,5,1,7,2,2,,,,,,,,,,,,,,,,,,,,,,,,,Spend time with his father,Take care of his father,Provide help for his father,Find a nursing home for his father,Ignore his father,1.575,77.941,82.209,25,91,97,91,89,98,95,81,93,85,75,68,63,13,1,4,,,,,,,,,,,,,,,,,,,,,,,,,,,,,,,,,,,,,,,,,,,,,,,,,,,,,,,,,,,,,,,,,,,,,,,,,She could stop and talk to the competitor,She can ignore the competitor,She can stare in a menacing way,She can push the competitor,She can use the competitor as motivation to keep going,0.581,82.466,83.657,37,40,80,50,90,70,91,19,29,36,5,3,4,70,92,82,,34,Male,Hispanic / Latino,,College Graduate (4 year),Rung 4
100,842,TRUE,R_3MgMyhEkfYkrNbd,,,,,,,,,,,,,,,,,,,,,,,,,Walk to the nearest town,Try and fix the car,Walk somewhere to get cell service,Get frustrated and hit the wheel,Wait for a car to pass by,3.038,43.33,97.139,13,91,100,88,27,100,85,89,100,91,88,63,100,20,73,73,,,,,,,,,,,,,,,,,,,,,,,,,,,,,,,,,,,,,,,,,,,,,,,,,,,,,,,,,,,,,,,,,,,,,,,,,Ration food,Keep warm,Try and signal for help,Keep the others calm,Still clearheaded,0.747,38.034,66.805,19,100,100,100,83,100,100,77,100,100,85,100,96,55,100,87,,,,,,,,,,,,,,,,,,,,,,,,,,,,,,,,,,,,,,,,,,,,,,,,,,,,,,,,,,,,,,,,,,,,,,,,,,,,,,,,,,,,,,,,,,,,,,,,,Break a window,Call the police,Get the person paged in the mall,Leave without doing anything,Try and pick the lock,5.734,5.901,29.042,2,29,67,35,66,100,100,71,100,100,9,0,52,0,53,13,,,,,,,,,,,,,,,,,,,,,,,,,,,,,,,,,,,,,,,,,,,,,,,,,,,,,,,,,,,,,,,,,,,,,,,,,Ration food,Keep people calm by showing leadership,Keep people's mind off the issue,Set up events that don't drain resources,Update people with new information,1.466,73.823,79.818,12,100,100,100,73,100,100,49,100,100,42,100,100,74,100,100,,,,,,,,,,,,,,,,,,,,,,,,,Close up the store,Call his boss,Leave without closing the store,Call someone else to come in,Try and change the court date.,7.841,74.932,100.945,4,29,55,51,89,100,100,9,13,14,67,85,85,3,100,26,Laugh at him,Continue the race,Ask why he's doing that,See if anything is wrong,Report him to the officials ,19.608,111.273,112.608,15,23,20,50,100,100,100,35,70,52,26,94,57,14,18,26,,42,Male,White / Caucasian,,College Graduate (4 year),Rung 4
100,623,TRUE,R_294B9hiPCRfi8fs,make payments for it,steal it,just wait ,borrow money,not give the medicine,10.56,10.56,59.383,1,87,100,100,5,0,0,40,33,31,100,100,100,20,1,13,hitchhike,walk home,walk to airport,postpone trip,just wait,13.981,13.981,70.075,1,98,93,96,71,69,74,71,95,68,76,56,48,75,95,63,He could add his own money in it,just leave now,wait for manager,say someone robbed him,just not say anything about it,18.791,18.791,83.392,1,55,64,55,72,29,35,97,95,97,18,6,2,80,37,64,,,,,,,,,,,,,,,,,,,,,,,,,tell the teacher,leave school,not go to class,steal another students work,cheat,10.945,10.945,78.138,1,100,100,100,15,2,2,25,8,7,5,1,1,42,1,22,,,,,,,,,,,,,,,,,,,,,,,,,sneak in,buy it off someone ,go home,wait for friends,go eat,15.096,15.096,50.468,1,66,9,24,75,93,85,94,97,97,80,100,100,28,93,27,,,,,,,,,,,,,,,,,,,,,,,,,,,,,,,,,,,,,,,,,,,,,,,,,ride his friend ,say no,ignore ,pretend he does not know,ask for money,14.43,47.701,74.703,3,97,95,98,63,32,64,41,9,7,38,1,16,65,47,75,,,,,,,,,,,,,,,,,,,,,,,,,,,,,,,,,,,,,,,,,,,,,,,,,,,,,,,,,,,,,,,,,,,,,,,,,,,,,,,,,,,,,,,,,,,,,,,,,,,,,,,,,,,,,,,,,,,,,,,,,,,,,,,,,,,,,,,,,,,,,,,,,,,,,,,,,,,,,,,,,,,,,,,,,,,,,,,,,,,,,,,,,,,,,,,,,,26,Male,White / Caucasian,,High School or equivalent,Rung 2
100,2013,TRUE,R_1GE9HOD8mxurcmT,expensive medication,covered insurance,want to purchase,want to recover,dog was fallen,3.645,66.597,72.276,8,54,42,54,26,33,37,58,55,59,41,52,48,46,54,51,,,,,,,,,,,,,,,,,,,,,,,,,evening manager,$500.75 was missing,want to register,money at end of the day,closeup in 5 minutes,2.452,65.207,78.996,6,59,48,57,43,46,59,33,38,62,36,39,68,49,46,54,,,,,,,,,,,,,,,,,,,,,,,,,,,,,,,,,,,,,,,,,,,,,,,,,,,,,,,,,,,,,,,,,,,,,,,,,,,,,,,,,,,,,,,,,,,,,,,,,,,,,,,,,,,,,,,,,,,,,,,,,,,,,,,,,,,,,,,,,,,,,,,,,he ride a nearby city,same direction,10 miles further ,way home from work,childhood  friend,11.653,227.101,261.784,7,51,44,59,36,38,70,49,43,43,37,46,41,68,56,57,,,,,,,,,,,,,,,,,,,,,,,,,,,,,,,,,,,,,,,,,,,,,,,,,,,,,,,,,,,,,,,,,,,,,,,,,she feels about mother,she feels about her father,she manage the other people,want care father,she want achieve life,12.962,112.299,113.924,10,51,54,57,90,92,82,47,67,69,64,79,77,67,68,87,To crew Ahmed should be strong enough,should call the navy team,they call the marine rescue,passengers should be safe movement,crew should come fast,27.84,1037.456,1071.329,21,55,54,60,46,59,62,55,57,63,41,58,59,68,53,55,,,,,,,,,,,,,,,,,,,,,,,,,,,,,,,,,,,,,,,,,,,,,,,,,avoid cigarette,very danger,it affects the health,it affects the nearby person,don't use the taboo,49.296,124.119,125.806,7,51,49,53,39,26,43,74,83,91,68,75,76,94,56,69,,41,Male,White / Caucasian,,College Graduate (4 year),Rung 4
100,1214,TRUE,R_2V9YlTxIERwQYhz,,,,,,,,,,,,,,,,,,,,,,,,,Wait in the car and hope someone will drive/walk by,Get out and start walking,Find a safe place to stay for the night,Try to make a smoke signal,Try to fix the car,0.417,119.009,172.176,4,83,95,91,74,92,92,63,88,58,46,92,43,94,98,92,Be honest with the manager and let them know what happened,Put up the money out of pocket,Check the register again,Make sure the money has been been misplaced somewhere at the store,Give up and start looking for another job the next day,136.08,249.322,316.273,3,72,100,89,87,69,80,100,100,94,100,100,90,48,62,41,,,,,,,,,,,,,,,,,,,,,,,,,,,,,,,,,,,,,,,,,,,,,,,,,,,,,,,,,,,,,,,,,,,,,,,,,,,,,,,,,,,,,,,,,,,,,,,,,,,,,,,,,,,,,,,,,,,,,,,,,,,,,,,,,,,,,,,,,,,,,,,,,,,,,,,,,,,,,,,,,,,,,,,,,,,,,,,,,,,,,,,,,,,,,,,,,Leave the knife and go through security,Pay the fine anyway,Ask to see if he can leave the knife there and have a family member or friend to pick it up,Try to hide the knife,Try to reason with the security to avoid paying fine,0.877,0.877,104.416,1,17,56,14,82,90,70,62,86,68,83,32,48,55,72,60,Be honest with his friend,Try to contact the taxi company/driver,Pretend someone stole the ring,Not show up,Find something else to replace the ring,2.294,46.931,64.126,3,90,100,91,100,100,96,57,24,40,18,8,8,41,11,18,,,,,,,,,,,,,,,,,,,,,,,,,Be honest with everyone,Try contacting other ships for help,Serve less food to everyone,Restrict number of meals served (skip in between snacks),Ask people to skip a meal if not too hungry,23.379,24.159,137.038,2,86,100,97,86,100,97,78,73,76,71,89,66,45,58,51,,,,,,,,,,,,,,,,,,,,,,,,,,,,,,,,,,,,,,,,,,,,,,,,,Keep going,Smoke with them,Remind them it's a competition,Pretend not seeing them,Tell officials that they are smoking while competing,0.664,132.271,132.77,4,100,100,95,50,41,45,81,96,71,91,75,75,42,54,32,,32,Female,Asian / Pacific Islander,,Vocational/Technical School (2 year),Rung 3
100,495,TRUE,R_1DBY63IAa1YsJ45,,,,,,,,,,,,,,,,,,,,,,,,,call 911 since the phone will still work for that,flag down a passerby for help,sit and listen to the radio,walk to a gas station nearby for help,try to fix the car,1.707,1.707,65.076,1,52,100,88,52,100,89,11,100,21,10,100,24,92,100,91,,,,,,,,,,,,,,,,,,,,,,,,,borrow a phone,ask to have someone get a message to her friend,wait outside until her friend sees her,go get her phone in the office and call,bang on the doors and demand to be let in,11.569,11.569,52.802,1,90,100,100,100,100,100,9,100,53,19,100,17,9,1,9,,,,,,,,,,,,,,,,,,,,,,,,,,,,,,,,,,,,,,,,,,,,,,,,,,,,,,,,,,,,,,,,,,,,,,,,,,,,,,,,,,,,,,,,,,,,,,,,,,,,,,,,,,,,,,,,,,,,,,,,,,,,,,,,,,,,,,,,,,,,,,,,,,,,,,,,,,,,,,,,,,,,,,,,,throw it in the trash,hand it in to security,try to get it through security,insist it was planted on him,put it into his checked baggage,1.64,1.64,39.364,1,78,100,88,83,100,89,1,1,9,1,1,1,52,51,53,confess to his mistake,say he dropped it in the grass,say they don't need a ring,make a ring out of something fast,call the cab company and get the ring,1.48,1.48,30.32,1,90,100,92,48,16,50,10,2,12,8,3,6,93,100,93,,,,,,,,,,,,,,,,,,,,,,,,,,,,,,,,,,,,,,,,,,,,,,,,,cut off the finger,eva goes down the mountain to get help,they set up camp for the night,they put up a flare,the signal with a mirror or smoke,1.949,1.949,35.592,1,1,1,1,100,100,100,28,30,34,51,100,83,13,100,32,,,,,,,,,,,,,,,,,,,,,,,,,ask for a cigarette,ask if they're okay,keep racing,take a break next to them,signal to someone they need help,1.546,1.546,32.959,1,1,1,1,92,100,93,92,49,83,9,54,12,51,94,55,,37,Female,White / Caucasian,,College Graduate (4 year),Rung 4
100,1985,TRUE,R_3fuXYQP6PUNIMru,,,,,,,,,,,,,,,,,,,,,,,,,,,,,,,,,,,,,,,,,,,,,,,,,Explain the situation to his manager,Quit his job,Offer to pay it back a little at a time,Pay it back in full,Tell his manager he was robbed,85.27,106.977,256.496,2,75,100,90,20,5,20,60,100,51,5,100,10,5,0,5,,,,,,,,,,,,,,,,,,,,,,,,,Show her teacher what happened,Ask her teacher for extra time,Ask a classmate for help,Try to redo the work quickly,Call in sick and stay home and redo it carefully,19.381,117.129,156.436,5,80,100,85,50,75,75,35,40,60,50,70,80,40,25,50,Use a compass to find your way out,Look for water ,See if he can use his phone for emergency assistance,Create a plan to follow,Hike up the mountain to gain a vantage point and scan for a town,30.668,260.442,261.452,8,75,100,100,75,100,100,90,100,100,61,100,100,50,75,75,,,,,,,,,,,,,,,,,,,,,,,,,,,,,,,,,,,,,,,,,,,,,,,,,,,,,,,,,,,,,,,,,,,,,,,,,,,,,,,,,,,,,,,,,,,,,,,,,,,,,,,,,,,,,,,,,,,,,,,,,Put the knife in his car,Try to sneak the knife through,Call somebody to come get the knife,Throw the knife away,Cancel his flight,23.801,105.803,120.538,7,75,100,100,10,0,10,25,50,50,20,60,40,5,80,10,,,,,,,,,,,,,,,,,,,,,,,,,Hire somebody to take care of him,Let his father live with him,Move him into an assisted living facility,Help take care of his father,See if a family member could help care for his dad,29.823,416.168,506.263,7,80,70,75,25,100,50,85,75,80,50,100,75,50,25,50,,,,,,,,,,,,,,,,,,,,,,,,,,,,,,,,,,,,,,,,,,,,,,,,,Call his boss,Call the court and explain his situation,Wait an hour for his boss,Try to get another employee to come into work,Leave and lock the store,22.367,112.359,125.241,3,90,90,100,40,75,50,75,90,80,40,50,50,25,40,25,,,,,,,,,,,,,,,,,,,,,,,,,,56,Male,White / Caucasian,,Some College,Rung 2
100,2354,TRUE,R_sef6c8E5yTeuv85,,,,,,,,,,,,,,,,,,,,,,,,,,,,,,,,,,,,,,,,,,,,,,,,,,,,,,,,,,,,,,,,,,,,,,,,,,,,,,,,,,,,,,,,,,,,,,,,,Inform the teacher of the accident showing the wet backpack,Ask a fellow student for a copy of the homework to photocopy and write over it,Lie and fake a family emergency asking for time to do it,Get everyone in class to not turn it in either and trick the teacher that its due the next class,Hand in nothing and accept the zero grade on it,279.755,467.848,473.381,32,100,100,100,55,88,51,37,5,67,5,5,5,74,93,92,,,,,,,,,,,,,,,,,,,,,,,,,Darya gives her ticket to Ted,Find someone in the area who is selling a ticket,Convince and pay someone who has a ticket to give up there own for Ted,Convince the group to skip the concert and do something else with Ted,Go see the concert without Ted,1.771,144.497,153.079,26,50,100,42,90,100,96,70,98,94,81,100,16,5,1,15,Signal to a lifeguard or nearby authority on duty of what is happening,Stop the teenager herself and other people nearby,Yell at the family playing in the water of what is happening,Video record the teenager doing the act for evidence,Wait until the family is back to tell you witnessed what happened,15.008,185.602,186.449,22,100,100,100,70,90,90,100,100,100,81,97,98,33,40,70,,,,,,,,,,,,,,,,,,,,,,,,,,,,,,,,,,,,,,,,,,,,,,,,,,,,,,,,,,,,,,,,,,,,,,,,,Throw the knife away to avoid the fine,Let the knife go through and accept the fine,Give the knife to a friend to hold onto and he can just use a different knife at the festival,Hide the knife where it can be found in his luggage to avoid the fine,Lie that the knife is from the US and not illegal,120.259,285.779,286.592,27,6,96,14,44,100,49,90,85,98,70,16,83,88,5,99,,,,,,,,,,,,,,,,,,,,,,,,,Bring his father to live with him,Ask other close family members if they could take care of him,Pay for his father to live in a luxury retirement home,Pay for a living assistant or nurse to visit his father regularly to take care of him,Find a new woman to marry and take care of his father,298.71,502.543,503.721,34,60,100,90,92,93,91,89,100,61,80,87,80,1,40,13,,,,,,,,,,,,,,,,,,,,,,,,,,,,,,,,,,,,,,,,,,,,,,,,,,,,,,,,,,,,,,,,,,,,,,,,,Keep going and focus on winning the race,Inform a race official of what she saw,"While passing by that competitor, yell and them to stop smoking",Stop her race to ask why that person is smoking,Give up as well and take a smoke break with that competitor,123.163,317.331,318.053,23,100,100,100,60,100,81,85,100,89,5,96,37,0,5,1,,29,Male,Asian / Pacific Islander,,College Graduate (4 year),Rung 6
100,989,TRUE,R_3nc02ZMMabB85Ut,,,,,,,,,,,,,,,,,,,,,,,,,,,,,,,,,,,,,,,,,,,,,,,,,,,,,,,,,,,,,,,,,,,,,,,,,ask the front desk to let her in to tell her friend,ask the receptionist to pass a message to the friend,use the phone at the front desk to call the friend,go into another business to call her friend,go back to the office for her phone,3.377,27.902,106.669,4,90,90,85,80,90,80,85,90,90,60,90,80,50,90,60,,,,,,,,,,,,,,,,,,,,,,,,,,,,,,,,,,,,,,,,,,,,,,,,,,,,,,,,,,,,,,,,,,,,,,,,,tell the family,tell a lifeguard,find a security guard,confront the individual,pretend like she didn't see anything,2.291,63.453,112.138,3,90,90,95,70,85,80,65,85,80,20,60,60,50,40,50,pull up next to the other car to see,slow down to see what the other car will do,pull over at the next rest stop,send a voice text to Chuck,pass the other car,2.326,21.692,100.802,4,80,90,85,65,85,80,50,80,75,45,80,65,40,70,60,,,,,,,,,,,,,,,,,,,,,,,,,,,,,,,,,,,,,,,,,,,,,,,,,,,,,,,,,,,,,,,,,,,,,,,,,,,,,,,,,,,,,,,,,,,,,,,,,ask the father to move in with him,ask another relative to help out,hire a caretaker,put the father in a nursing home,let the father fend for himself,2.729,76.998,95.187,6,50,90,75,80,80,75,90,70,75,45,40,50,30,35,40,,,,,,,,,,,,,,,,,,,,,,,,,go back for help,look for another hiker,ration the food and water,climb higher to try and get a signal,look for a water source,5.873,26.72,109.726,4,60,90,80,70,90,90,60,70,60,50,80,75,40,90,60,,,,,,,,,,,,,,,,,,,,,,,,,pass him by and ignore him,stop to see if he is OK,go faster to gain distance,stop to rest,ask why he stopped,3.47,28.218,95.116,4,85,80,80,70,90,80,75,80,85,45,85,80,60,80,75,,45,Male,White / Caucasian,,Some College,Rung 5
100,2173,TRUE,R_1eL7CHV5XgXdIIp,Put the dog to sleep,Get a job to make money,Steal the medicine,Sell drugs for money,Ask family for help,9.652,52.064,61.7,7,30,30,50,85,100,90,15,5,5,5,5,5,80,100,80,,,,,,,,,,,,,,,,,,,,,,,,,,,,,,,,,,,,,,,,,,,,,,,,,,,,,,,,,,,,,,,,,,,,,,,,,,,,,,,,,,,,,,,,,,,,,,,,,Look for food,Find shelter,Follow a river to a town,Build a fire,Look for landmarks,24.193,55.945,65.601,7,80,100,100,86,100,100,50,100,60,85,100,100,40,100,55,Buy a ticket from a scalper ,Go without Ted,Give Ted her ticket,Skip the concert,Sneak Ted inside,12.91,56.635,65.016,8,75,60,70,25,30,30,70,100,80,40,60,55,20,35,25,Do nothing,Ask the family if they know him,Ask him if he is with the family,Get a police officer,Fight the teenager ,10.8,54.356,61.312,9,85,75,100,90,100,100,70,100,100,50,90,60,20,40,20,,,,,,,,,,,,,,,,,,,,,,,,,,,,,,,,,,,,,,,,,,,,,,,,,,,,,,,,,,,,,,,,,,,,,,,,,,,,,,,,,,,,,,,,,,,,,,,,,,,,,,,,,,,,,,,,,,,,,,,,,,,,,,,,,,,,,,,,,,,,,,,,,,,,,,,,,,,,,,,,,,,,,,,,,,,,,,,,,,,,,,,,,,,,,,,,,Call his manager,Leave,Call in a coworker,Stay and cover the shift,Reschedule court appointment ,40.408,110.744,112.105,12,95,100,100,35,50,50,75,100,90,40,100,60,85,100,100,Take a break with the person,Pass the competitor ,Do nothing,Wave at the competitor,Smoke a cigarette ,56.652,156.7,178.528,8,25,100,50,90,100,100,90,100,100,80,100,80,20,50,30,,41,Male,White / Caucasian,,College Graduate (4 year),Rung 5
