"","id","context","text","group"
"1",1,1,"look for coupon",0
"2",2,1,"I ask my friends for help with this medication.",1
"3",3,1,"Get a side hustle to make some more money.",6
"4",4,1,"buy it for them",11
"5",5,1,"Ask friends and family for help while working more or looking for a better paying job.",1
"6",6,1,"I would borrow money or not pay other bills so I could get the medicine.",11
"7",7,1,"Sell any items of value that I have to pay for it.",7
"8",8,1,"find ways to make money quick or sell assets",7
"9",9,1,"I would take out a loan to pay for the medicine while cursing republicans for blocking universal healthcare.",4
"10",10,1,"I would look for help anywhere I could. Assistance from friends and family or even a loan. Anything. ",1
"11",11,1,"Ask a family member for help.",1
"12",12,1,"start working another job",6
"13",13,1,"Get a second job",6
"14",14,1,"try to get extra money or take out a loan for the medicine",4
"15",15,1,"Explore payment plan options",0
"16",16,1,"I would ask my friends, parents, and my spouse's family for a loan and pay them back asap.",1
"17",17,1,"borrow money from family",1
"18",18,1,"reach out of family for money",1
"19",19,1,"Set up a GoFundMe page and ask friends and family if they can help out financially.",2
"20",20,1,"I would sell expensive belongings. ",7
"21",21,1,"I need help for someone",-99
"22",22,1,"Call the pharmacy, see if I can a partial script of the medication or if there was a generic version. I would try using an app like GoodRX to see where the cheapest pharmacy would be. Possibly call the Dr to see if there are samples available. Or call the manufacturer of the medication, sometimes they have programs where people can medication for a very very cheap price or free. If all that fails I would ask someone if I could borrow the money, then start figuring out what I can sell or cut end to save the money to pay them back.  ",0
"23",23,1,"Get on mturk, go trade some crypto, borrow money, pawn stuff. any or all of those",0
"24",24,1,"sell some stuff to get the money",7
"25",25,1,"I would get the medication on credit.",0
"26",26,1,"Check the web for any ideas.",0
"27",27,1,"I would see what loans I can get.",4
"28",28,1,"try to raise money",2
"29",29,1,"sell something of value to buy it",7
"30",30,1,"By hook or by crook, I will come up with the money to make sure my spouse is alright.",0
"31",31,1,"Take out a loan",4
"32",32,1,"try to work for the money",6
"33",33,1,"Ask someone for help",1
"34",34,1,"borrow money",4
"35",35,1,"Sell whatever I can to make money.",7
"36",36,1,"Borrow the money.",4
"37",37,1,"id steal it",8
"38",38,1,"Ask around to see if any family members would be able to help",1
"39",39,1,"find extra income, start a gofundme in the mean time.",6
"40",40,1,"I would ask for money from someone.",1
"41",41,1,"I would go on gofundme.com and ask for assitance",2
"42",42,1,"apply for grants and get a second job.",0
"43",43,1,"borrow to get the medicine",4
"44",44,1,"Borrow money from a friend/family",1
"45",45,1,"Try to find every way possible to get a discount on this medication using a site like GoodRX, etc. Otherwise I'll have to borrow the money from somebody and pay them back.",12
"46",46,1,"borrow money",4
"47",47,1,"Reach out to relatives for help",1
"48",48,1,"Sell feet pictures.",0
"49",49,1,"try to borrow the money",4
"50",50,1,"I would look for alternative generic versions and/or contact the expensive medication company to see if there is any help for those can't afford it, which is more common these days",12
"51",51,1,"Charge it to credit card",11
"52",52,1,"I would start a go fund account.",2
"53",53,1,"I would either use my credit card or take out a personal loan from a friend or family member to buy it.",16
"54",54,1,"Get a second job",6
"55",55,1,"Try to find some work to do so I can pay for it.",6
"56",56,1,"Call my family and friends for help",1
"57",57,1,"I would contact friends and family to find the needed funds. ",1
"58",58,1,"I would find a way to increase my income, however i could. I would sell anything i had of value and look for side work. ",6
"59",59,1,"I would ask the bank for a loan.",4
"60",60,1,"I would first reach out to family and friends to see if they can help with the situation. ",1
"61",61,1,"I would ask someone close to me for a loan, then find an extra job or apply for a loan to pay them back.",1
"62",62,1,"Ask family for financial help.",1
"63",63,1,"I will steal the medication if I have to",8
"64",64,1,"The expensive prescription on the recover.",-99
"65",65,1,"I would exhaust as many avenues as possible to pay the prescription such as loans",4
"66",66,1,"I would go into as much debt as possible and declare bankruptcy",0
"67",67,1,"Take out a loan",4
"68",68,1,"I would contact family and churches to see if they can help us. ",1
"69",69,1,"I would poll from family first for options, but would take a loan or reverse mortgage to afford it for them.",1
"70",70,1,"get another job",6
"71",71,1,"Apply for medical/financial state assistance.",3
"72",72,1,"medical insurance",-99
"73",73,1,"try to borrow the money in any way possible (bank, credit cards, family or friends)",4
"74",74,1,"more information to collect and get it",-99
"75",75,1,"I would attempt to switch to an insurance that does cover the medication. If I absolutely could not do that, I would start a fundraiser asking my community for help.",13
"76",76,1,"I make a request on go fund me and take out a loan to afford the medication. ",2
"77",77,1,"I would ask around the group of people I know who dabble in illegal stuff and see if it can be aquired. If not I would have to find out where it is a break in and take it without getting caught.",0
"78",78,1,"Search of coupons ",10
"79",79,1,"I would see if there are things I can sell to come up with some quick cash or take out a loan.",7
"80",80,1,"Let primary care physician know the circumstances.  Ask if there are any programs that will help cover the medicine.  Ask if there is a generic for the drug or another cheaper drug that will have same effect.  ",14
"81",81,1,"I would go ask my mom for the money to help me get her medicine!",1
"82",82,1,"I would sell something we have to try and cover the cost and look for another job to make more money",7
"83",83,1,"Drain my savings or put it on a credit card. It isn't an optional thing, they have to have it, so I will do what is necessary to get it.",11
"84",84,1,"stop and help",-99
"85",85,1,"I would look to any programs that might help.",3
"86",86,1,"I ask my friend or other person",1
"87",87,1,"take out a loan an get the medicine",4
"88",88,1,"Get a second job or take out a loan. Either way I would prioritize her life.",6
"89",89,1,"I asked money from my friends",1
"90",90,1,"I would do whatever I had to do in order to get the money.",0
"91",91,1,"I would go to the ER at my local hospital.",0
"92",92,1,"I would try and steal it from the pharmacy. ",8
"93",93,1,"Take out a credit card",0
"94",94,1,"Take another shift for work in order to make more money ",6
"95",95,1,"I would sell my car",7
"96",96,1,"Ask to borrow the money",1
"97",97,1,"Look into options like rx savings or different insurance",13
"98",98,1,"Lobby your insurance to get it covered. Raise a stink on social media and raise the funds via GoFundMe while shaming the insurance company publicly.",14
"99",99,1,"Contact the manufacturer to see if it can be donated, post a gofundme, go to the local health clinic to see if it is available through them.",0
"100",100,1,"Call the pharmaceutical company, the hospital, charities, etc. until aid is found.",14
"101",1,2,"Call someone to help",4
"102",2,2,"I would call a towtruck to tow my car to the airport, so I can catch my flight. I will worry about my car being broken when I get home.",2
"103",3,2,"Push the car out of the way and start dealing with the issue.",13
"104",4,2,"just continue my way there",0
"105",5,2,"Call a tow truck to take me to airport parking.",2
"106",6,2,"I would call a Lyft and ask my husband to call AAA for the car to have it towed home or to the mechanic's.",1
"107",7,2,"Call an uber or Taxi.",1
"108",8,2,"call a cab",1
"109",9,2,"I would call the police to report my situation and call AAA to move my car.",2
"110",10,2,"Call a tow truck and an uber and have both ready to pick up the car and me. ",2
"111",11,2,"leave the car call a cab.",1
"112",12,2,"call family to see if they can get me to the airport",4
"113",13,2,"Call a tow truck and an Uber. Have the car towed to a trusted mechanic and continue to your trip. ",2
"114",14,2,"Try to get a taxi or uber to pick me up and take me to the airport",1
"115",15,2,"Call a tow truck and a close friend and see if they can come wait with my car while I grab a cab to the airport.",4
"116",16,2,"I would call a friend or my brother that I left my car there, and jump on an Uber to get to the airport.",4
"117",17,2,"call an uber or family member for a ride",1
"118",18,2,"Leave the car and call an uber. while in the uber call a relative and tell them to take care of the car.",1
"119",19,2,"Call an ride service or taxi or check to see if I am near a rapid transit system that would bring me to the airport. ",1
"120",20,2,"I would call friends and family until I found someone to take care of my car then I would call an uber to drive me to the airport. ",4
"121",21,2,"I have said that help for someone and get the plane.",-99
"122",22,2,"Call a tow truck first, they take forever to get there. Call a family member or a friend to come take your place, have them bring someone else who can drive you to the airport.",0
"123",23,2," I probably call a tow truck to take the car home and get an uber to the airport. This isn't even a big deal if I left early enough",2
"124",24,2,"cancel the flight, call a towtruck",5
"125",25,2,"I would have purchased the insurance. First I'd deal with the towing service then get my plane tickets refunded/reschedule the trip.",2
"126",26,2,"Skip the safari, fix the car.",5
"127",27,2,"I would have to just wait with my car and probably miss my flight unless I have a friend in the area.",5
"128",28,2,"call for help",0
"129",29,2,"call for a cab",1
"130",30,2,"Call a tow truck for the car, have them drop it off at my home and catch a taxi to the airport.",2
"131",31,2,"Call a friend to handle the car and take an Uber",4
"132",32,2,"flag down a driver for help",11
"133",33,2,"hitch hike",3
"134",34,2,"call uber, tow truck",1
"135",35,2,"Call a cab.",1
"136",36,2,"Call a friend to get the car and take you to the airport.",4
"137",37,2,"call a friend",4
"138",38,2,"I would have no choice but to call a tow truck, then try and catch a cab to the airport",2
"139",39,2,"call to have car towed back to house, uber to airport.",2
"140",40,2,"I would call a taxi or friend to come pick me up after I have locked my car and secured my valuables.",1
"141",41,2,"I would call AAA",2
"142",42,2,"call a tow truck and reschedule flight.",2
"143",43,2,"call a towing company and police and let them know. call an uber to get to the airport",2
"144",44,2,"reschedule flight",7
"145",45,2,"Call a tow service and also call an Uber; I'll have to take care of my car when I get back, but I need to get to this trip!",2
"146",46,2,"catch a different flight",7
"147",47,2,"Call highway patrol or my car insurance to get help getting my car moving again",2
"148",48,2,"Decide I probably shouldn't hunt animals like that anyways and go home.",5
"149",49,2,"try and call an uber",1
"150",50,2,"Call a taxi for a ride to the airport, and call a tow truck to get the car to storage until I return from the safari.",1
"151",51,2,"Call AAA and get help.",2
"152",52,2,"I would call a tow truck and have them tow the car and call a cab to take me to the airport",2
"153",53,2,"I would call a close friend to see if they could either pick me up, or if they could get my car while I called a cab.",4
"154",54,2,"Call a Uber ",1
"155",55,2,"Try to reschedule the flight and get the car towed home.",7
"156",56,2,"Call a friend to come pcik the car and i catch a taxi to the airport",4
"157",57,2,"I would call a friend to come sit with my car and an Uber to take me to the airport so I don't miss my flight. ",4
"158",58,2,"Hopefully come to my senses and not participate in such a cruel activity. But i would be very worried, i might try to call the airport and alert them and see what my options were for a later flight. ",5
"159",59,2,"I would call a taxi.",1
"160",60,2,"Call the emergency roadside assistance and explain the situation. If they are going to be unable to figure it out in time, then call the airport and see if I can reschedule my flight. ",14
"161",61,2,"I would call a tow truck to get my car home, then I would call a ride-sharing service to take me to the airport.",2
"162",62,2,"Get an Uber to the airport.",1
"163",63,2,"Call for an uber ",1
"164",64,2,"The intersection is good and well apperance.",-99
"165",65,2,"I would first call an uber or ride service to arrive on time. Then call a towing or mechanic service to handle the car.",1
"166",66,2,"I would call a tow truck to tow me to the airport lot",2
"167",67,2,"Miss the hunting safari",5
"168",68,2,"I would call a tow truck to tow my car to the Airport while I got a ride from a taxi or Uber. I'd worry about the issue after I got back and plan for fixing it during the trip. t",0
"169",69,2,"I would order a cab or uber to get to the airport.",1
"170",70,2,"Call a cab and a tow truck",1
"171",71,2,"Call for a tow and miss the flight.",2
"172",72,2,"yes next car book in airport ",-99
"173",73,2,"call roadside assistance, have the car towed to the shop and take an uber to the airport",2
"174",74,2,"fast to go it ",-99
"175",75,2,"Well, I would call for help (a tow truck) and possibly attempt to still make it to the airport in time. However, if I couldn't make it to the airport and still get my car safely off the road, I would have to take the loss. Things happen and it can't be the end of the world. Sometimes, things don't go as planned and I have learned to roll with it. I would take it as ""a sign I was not meant to go"" and return home. ",2
"176",76,2,"I call friends and family to take care of the car issue. I'll likely get it towed and seek an uber to the airport.",4
"177",77,2,"I wouolod get the car off of the road and push it somewhere safe. I would call an Uber ride to make it to the airport. While on the way I will make arrangements to have my car picked up or towed.",0
"178",78,2,"Reschedule my flight ",7
"179",79,2,"I would call a friend or family member that can come take care of my car and get it towed away and I would call an uber or taxi to get to the airport.",4
"180",80,2,"call a family member to stay with car, then call Uber",4
"181",81,2,"I would try to flag someone down to see if they could give me a ride and if they did stop and give me a ride then I would call for a wrecker to haul my car to my mom's house .",3
"182",82,2,"I would call the airport to see if I could catch a later flight.",7
"183",83,2,"I would call AAA and an uber. Hopefully my family will ensure my car makes it back with AAA and the uber will hopefully get me to the airport in time",2
"184",84,2,"Unsure what to do",-99
"185",85,2,"I would leave my car and hitch a ride and call a friend to have it towed for me.",3
"186",86,2,"I am going to pick up the air flight",-99
"187",87,2,"start speeding",0
"188",88,2,"Call friends and family to see if they can handle my car. Call a tow truck and then either an Uber or friend to drive me to airport. Deal with the car when I get back.",4
"189",89,2,"I cross that street and rent a new taxi",1
"190",90,2,"i would hire a ride-sharing service, and call a friend to get my car to a mechanic.",1
"191",91,2,"I would call uber and a tow truck.",1
"192",92,2,"I would try and get to there by foot. ",6
"193",93,2,"Call a tow truck and get the car towed to a mechanic and Uber to the airport",2
"194",94,2,"Call a friend for help",4
"195",95,2,"I will call a friend ",4
"196",96,2,"call a tow truck and reschedule my flight",2
"197",97,2,"Have the car towed to a repair shop and call an Uber to the airport.",2
"198",98,2,"Skip the trip, miss your flight. Hunting safaris are gross.",5
"199",99,2,"Call AAA or a tow truck and a taxi.",2
"200",100,2,"Call for a tow truck, while waiting for the tow call shops to find one that can accept the tow without you there. Call a taxi/Uber for yourself to the airport.",2
"201",1,3,"Call the other manager",0
"202",2,3,"I will count down all registers and check in the cracks to make sure I didn't miss anything. If I didn't I would watch the camera.",13
"203",3,3,"Put my money in the register.",1
"204",4,3,"pay the difference",1
"205",5,3,"Use my own money to balance the til.",1
"206",6,3,"I would put money in and question anyone else that was around.",1
"207",7,3,"Use money from my own pocket",1
"208",8,3,"I would try to solve how the money is missing. Also I would recount the drawer",13
"209",9,3,"Report the situation to my manager.",2
"210",10,3,"I would explain what happened and take the job loss.",0
"211",11,3,"Put in 50.75 of your own money.",1
"212",12,3,"add $50.75 of my own money into the register",1
"213",13,3,"Re-check the daily sales to make sure that money is actually missing.",9
"214",14,3,"leave a note and check the tape the next day to see why it may be short",8
"215",15,3,"Review my transactions for the day and see if anything looks unusual",9
"216",16,3,"I would put some of my own money to make up for the missing amount so that I don't lose my job.",1
"217",17,3,"tell boss to check the cameras",2
"218",18,3,"I would recount the money and if it wasn't there report what happen",9
"219",19,3,"Review the receipts for the day and question the cashier(s).",9
"220",20,3,"I would search everywhere for the money and recount the money. If both fail then I would call all the cashiers that worked to find out if any of them knew what happened. ",13
"221",21,3,"I have maintain for my peace and solve the missing amount for confidently",-99
"222",22,3,"I would report it to the manager, it could have been a mistake from the previous shift. I would go through all the steps and procedures in finding the mistake, it could have been in a form of a check or a mistake ringing up. No way ever would I put my own money into the register to make it even, lose of job or not. ",2
"223",23,3,"I'm honest with the boss and we figure out together what happened. It's likely data was entered wrong",2
"224",24,3,"i'd replace the money",1
"225",25,3,"Explain this to the manager. If they don't believe me then I don't want to work there anyway.",2
"226",26,3,"Talk it over perhaps with anyone involved, add my own funds to cover it if needed.",4
"227",27,3,"I would ask around and see if anyone knows why that amount of money is missing.",4
"228",28,3,"put in my money",1
"229",29,3,"make sure the amount is covered",0
"230",30,3,"I cover the register and have security run the cameras and audit the registers so we can find out what went wrong.",8
"231",31,3,"Ask around if there are any mistakes",4
"232",32,3,"tell the manager",2
"233",33,3,"Quit and run away",7
"234",34,3,"tell my boss",2
"235",35,3,"Go back through and make sure that it's actually missing.",9
"236",36,3,"Attempt to find the discrepancy, then be honest.",9
"237",37,3,"pay it out of pocket",1
"238",38,3,"I would check the drawers again, feeling around, and search the floor in case any money fell or got stuck somewhere",13
"239",39,3,"let my boss know, investigate what happened.",2
"240",40,3,"I would find the missing money before my shift is over.",13
"241",41,3,"I would inform my boss that a big amount is missing",2
"242",42,3,"Put the money in out of my pocket.  Try to figure out what went wrong.",1
"243",43,3,"recount the money in case their is a mistake",9
"244",44,3,"Put my own money in it",1
"245",45,3,"Input $50.75 worth of purchases that didn't actually happen so the register is balanced",3
"246",46,3,"I would try to figure out what happened to the money",4
"247",47,3,"Call whoever was working the register to ask if they know anything, if not I'd call my boss to see what the procedure is",4
"248",48,3,"Put 50.75 of my own money in.",1
"249",49,3,"count it again and pray",9
"250",50,3,"Do my best to go back through tape to figure out where the mistake happened, then talk to management about it.",8
"251",51,3,"Note the loss at the end of the shift.",1
"252",52,3,"After counting the money again and again I would put the money in the register and hope for the best.",6
"253",53,3,"I would double count then document the discrepancy for the accountants to review.  I would not be afraid of losing my job because it was obviously a one off situation.",0
"254",54,3,"Pay the money back",1
"255",55,3,"Count the drawer again and be sure that the total is correct, also check for any credits that may have been issued.",9
"256",56,3,"I will bear the cost and replace the money",1
"257",57,3,"I would tripple check the funds. If the till was still short I would add the money from my own cash. ",9
"258",58,3,"I would recount everything a few times and then contact upper management to ask them what to do in the situation. ",9
"259",59,3,"I would add the missing money from my own money.",1
"260",60,3,"Recount the money and make sure that the total is incorrect. If it is still incorrect then call my supervisor and let them know the issue and see how they want to proceed. ",9
"261",61,3,"I would put my own money into the register.",1
"262",62,3,"Put in my own money to balance it.",1
"263",63,3,"Pay the restaurant and figure it out tomorrow ",1
"264",64,3,"The doller is high on the budject.",-99
"265",65,3,"I would calmly approach my employees asking if they saw anything or know anything and then check on possible camera footage to get the full picture",4
"266",66,3,"I would notify a manager immediately",2
"267",67,3,"Find out where the discrepancy is",13
"268",68,3,"I would recount all the money, then check the cameras. ",9
"269",69,3,"I would leave a note explaining the situation, or call the upper admin to explain what I found. I would potentially offer paying the difference, but am confused how this discrepancy would occur.",2
"270",70,3,"Put my own money in the register",1
"271",71,3,"File a report explaining money is missing. Review security tapes, find the theif.",8
"272",72,3,"pay in money",-99
"273",73,3,"Report the shortage to your supervisor ",2
"274",74,3,"I give my best.",-99
"275",75,3,"I would call the owner or the boss, whoever I report to, and let them know right away that my drawer is missing $50.75 so we could check the cameras to see if an employee took it. If it were found to be something I did mistakenly (give an extra 50 back in change, two 50s stuck together or something like that) than I would offer to have it taken out of my paycheck. But only if were my fault. ",2
"276",76,3,"I'd ask people im working with to see if we can find the money and if not I'd put my own money back in the register to avoid being fired.",4
"277",77,3,"I would have no choice but to pay the money back that I owe since it is my responsibility.",1
"278",78,3,"Review why it is short",9
"279",79,3,"I would recount the money to make sure there was no error. Then if I had to replace the money I guess thats what I would have to do.",9
"280",80,3,"Recount.  Document.  Nothing much else you can do.",9
"281",81,3,"I would recheck it and if it was still short then I would have to take money out of my pocket to cover it and then tell the employer that one of the other employees is coming up short with how they are figuring the cash register either they are pocketing or adding something wrong so we need to check them out and see what is going on.",9
"282",82,3,"I would mae a note of the missing money to tell the manager.",2
"283",83,3,"Well I suppose I would give my own money to make the drawer even but I'd definitely be going over the day's purchases and checking security cameras if there are any for evidence of theft.",1
"284",84,3,"put own money in",1
"285",85,3,"I would go through it again to see if I can find the issue. Then ask the employees if they have any idea.",9
"286",86,3,"I get another job right now",0
"287",87,3,"put in my own money",1
"288",88,3,"Double check the count and see if anyone took money from my register for theirs. If neither turns up the difference then fill the register due to my own mistake.",9
"289",89,3,"I check the accounts and Verify the CCTV camera weather other person steal the amount",8
"290",90,3,"I would replace it with my own money.",1
"291",91,3,"I would not use money out of my pocket.",0
"292",92,3,"try and make up for the money by replacing it through my own pocket. ",1
"293",93,3,"Recount the money and schedule time to talk to the owner the next day",9
"294",94,3,"I would take a look at the surveillance cameras.",8
"295",95,3,"I would fill it with my own money",1
"296",96,3,"recount the money and call the manager",9
"297",97,3,"I would replace the money until I was able to discuss this with my manager",1
"298",98,3,"Put my own money in, $50.75, to balance it and then pay attention at work to see who is skimming from the register.",0
"299",99,3,"Go through the receipts again and leave a shortage message if necessary.",9
"300",100,3,"double count the drawer and safe",9
"301",1,4,"Ask for a guest pass",8
"302",2,4,"I would pay for a new membership.",1
"303",3,4,"Renew my membership.",1
"304",4,4,"leave a message",10
"305",5,4,"Ask if the employee can let my friend know I will not be making it.",13
"306",6,4,"I would ask to borrow the desk phone or go back to the office for my own phone",2
"307",7,4,"Renew my membership.",1
"308",8,4,"I would leave a note for her at the reception desk and describe her to the person working there so they could give her my note",10
"309",9,4,"I would renew my membership or pay a daily fee to go play.",1
