"","id","context","text","group"
"1283",83,13,"Jeez. I would flag down the nearest responsible person that isn't in the wedding party, explain the situation to them, try to get the ceremony drawn out, and call the taxi and hope for the best.",11
"1284",84,13,"go get the phone",0
"1285",85,13,"I would tell my sister.",2
"1286",86,13,"I go to buy another ring",5
"1287",87,13,"tell her i lost the ring",2
"1288",88,13,"Explain and try to find it. Offer to replace it if needed.",18
"1289",89,13,"I asked anyone had a new ring for wedding gift",0
"1290",90,13,"I would give her another ring as a temporary replacement to use in the ceremony and get the original ring back from the taxi company later.",3
"1291",91,13,"I would call the taxi company and freak out.",1
"1292",92,13,"Try and find the keys ",-99
"1293",93,13,"Tell someone at the wedding in order to not make a scene and then excuse myself to start calling the cab company",11
"1294",94,13,"Call the taxi company immediately to narrow down the best wat to reach the driver.",1
"1295",95,13,"Call the taxi deriver",1
"1296",96,13,"Shit my pants",15
"1297",97,13,"Panic but immediately call the taxi service to have them see if it was still there",15
"1298",98,13,"Announce the truth. Ask the audience for a stand-in ring.",0
"1299",99,13,"Let everyone know I do not have the ring and find a temporary substitute.",0
"1300",100,13,"Call the taxi ",14
"1301",1,14,"Research other options. Possibly move to bigger place.",3
"1302",2,14,"I make as much room as possible and take care of him.",1
"1303",3,14,"Make it work, family comes first.",0
"1304",4,14,"ask relatives to help",4
"1305",5,14,"Reach out to family to figure out a way to get his needs met and apply for state assistance.",4
"1306",6,14,"I would still move him in to my apartment.",1
"1307",7,14,"I would move in with him to care for him or I would get a bigger apartment.",2
"1308",8,14,"look into community resources for him",6
"1309",9,14,"I would find new living conditions that work for the new situation.",3
"1310",10,14,"Ask another family member for help. They also should help if they could. I should have someone to count on in my family. ",4
"1311",11,14,"Let him stay at my apartment.",1
"1312",12,14,"move in with my father",2
"1313",13,14,"Find a house and move in with Dad.",3
"1314",14,14,"see if there is another relative he could stay with",4
"1315",15,14,"Move in to his home or find an in home caretaker",2
"1316",16,14,"I would talk to my brother to see if we can come up with enough money for a retirement home. If not, I would let my father live with me and apply for welfare.",4
"1317",17,14,"ask a relative for help",4
"1318",18,14,"See information online or look for low income housing. In the meantime he stays with me.",0
"1319",19,14,"I would take him into my home regardless of the space available.",1
"1320",20,14,"I would contact his doctor to see if he knows of any charities that could help. ",9
"1321",21,14,"I have definitely buy a another apartment for my father.",3
"1322",22,14,"Move in with my father into his house. If it is too small then get a bigger place to live. ",2
"1323",23,14,"It doesnt matter what it takes, I figure it out. Probably first I get on the phone to find available resources",0
"1324",24,14,"find him a roommate",0
"1325",25,14,"There are facilities to deal with this situation funded with tax money.",6
"1326",26,14,"He moves in for a while.",1
"1327",27,14,"I would have to take him in and try to find a larger place.",3
"1328",28,14,"try to raise money",14
"1329",29,14,"find a friend to take care of him",16
"1330",30,14,"I will downsize my belongings to have more space and make dad my roommate.",1
"1331",31,14,"Move in with my father",2
"1332",32,14,"let him live with me",1
"1333",33,14,"take care of him",7
"1334",34,14,"keep him with me",1
"1335",35,14,"Make room for him at my apartment",1
"1336",36,14,"Move him in with me.",1
"1337",37,14,"get a bigger place",3
"1338",38,14,"I would do my best to move things around so that a second person could fit",1
"1339",39,14,"spend time teaching him what he needs to know to aid himself, ask others to help.",0
"1340",40,14,"I would find my father some additional help using other outside sources.",0
"1341",41,14,"Ask for government assitance",6
"1342",42,14,"move in with him.",2
"1343",43,14,"get a bigger place or move in with him",3
"1344",44,14,"Live with roommate and leave him to have my apt",0
"1345",45,14,"Move him in anyway! Not much I can do about it",1
"1346",46,14,"get him help from family members",4
"1347",47,14,"Reach out to relatives for help",4
"1348",48,14,"Take care of him anways",1
"1349",49,14,"look for another apartment",3
"1350",50,14,"Take him in while continuing to look for a place to take care of him.",1
"1351",51,14,"I'd move in with him.",2
"1352",52,14,"I would either move to a bigger apartment or move in with my father at his home.",3
"1353",53,14,"I would ask my father if he would like me to move in with him and help him and for company.",13
"1354",54,14,"Move into your fathers house ",2
"1355",55,14,"Move him into an assisted living apartment, hopefully, he has low income, otherwise I'm not so sure.",0
"1356",56,14,"Ask for help for me to be able to get a bigger space",0
"1357",57,14,"I would move in with himn if there was room. If not I would move him in with me until we could locate a more comfortable place for us to live. ",2
"1358",58,14,"Move in with him where he is living. ",2
"1359",59,14,"I would try to find him a temporary accommodation with a family friend until I can sort out the situation.",16
"1360",60,14,"I would look into help/assistance programs for taking care of the elderly long term. In the short term I would take on the burden of care. ",6
"1361",61,14,"I would get loan and see if we could move somewhere bigger. I would ask if another family member could help.",15
"1362",62,14,"Ask other relatives for help.",4
"1363",63,14,"Find a relative to assist ",4
"1364",64,14,"The room is free on the person.",-99
"1365",65,14,"I would ask any other relatives if they could short term look after him until I find a place for the both of us.",4
"1366",66,14,"I would let him move in until I can find a bigger place",1
"1367",67,14,"Make it work with the space you have",1
"1368",68,14,"I'd attempt to find in home care for him. ",10
"1369",69,14,"I would ask around my family and explain the situation and see if we can come together to provide a solution to this for dad.",4
"1370",70,14,"I would take him in and care for him.",1
"1371",71,14,"Move my father in with me anyway.",1
"1372",72,14,"i am out ",-99
"1373",73,14,"Temporarily move in with my father until I can better assess the situation and create a plan for moving forward.",2
"1374",74,14,"I definitely to go ",-99
"1375",75,14,"I would move in with him or, even if it is a tight squeeze, I would move him in with me anyway and he could have the living room. I would never abandon either of my parents after all they have done for me.",2
"1376",76,14,"I would put my father in my living room and make due with what I have. I'd also call a social worker to get help in getting my father some sort of help.",1
"1377",77,14,"I would try to find him a cheap apartment, if not I would just have to make due in my apartment until I could come up with a better solution.",3
"1378",78,14,"Seek Additional help ",0
"1379",79,14,"I would take my father in and we would make do until I could get us into a bigger place.",1
"1380",80,14,"Time for family conference.",4
"1381",81,14,"I would rent a big place with our combined income and take care of him myself.",3
"1382",82,14,"I would try to find a bigger apartment where I could take care of him.",3
"1383",83,14,"I'd make room in my apartment. There's no way you can tell me that we wouldn't be able to fit him in somehow. Either that or we would find a new apartment with more room or I'd move into his existing house.",1
"1384",84,14,"help him out",0
"1385",85,14,"I would move in with my father.",2
"1386",86,14,"I use my job",-99
"1387",87,14,"take out a loan and put him in a nursing home",15
"1388",88,14,"Try to find a solution with hospice.",0
"1389",89,14,"I build another room for my father",0
"1390",90,14,"I would get a bigger apartment and live there with my father.",3
"1391",91,14,"I would move in with my father at his place.",2
"1392",92,14,"I would take care of him myself. ",7
"1393",93,14,"Move him in with me anyway",1
"1394",94,14,"Find a way to move him in ",1
"1395",95,14,"I would take him to my place still",1
"1396",96,14,"ask family for help",4
"1397",97,14,"Move in with him and help take care of him",2
"1398",98,14,"Move my father in with me and tough it out until I can get a bigger place.",1
"1399",99,14,"Use his pension and combine it my income to afford a somewhat larger dwelling.",3
"1400",100,14,"Move in with father, if no other siblings can.",2
"1401",1,15,"Do some math and ration food",1
"1402",2,15,"I pray for a miracle to happen for all of us on the ship.",0
"1403",3,15,"Let the crew know to start rationing food and water.",1
"1404",4,15,"eat less, ration, triage",2
"1405",5,15,"Ration food and try to assign people tasks to keep them distracted and hopeful.",1
"1406",6,15,"I would conserve food but make sure there was ample water.",1
"1407",7,15,"Set off flares.",6
"1408",8,15,"I would count the food supply, secure it, and come up with a ration plan before telling everyone.",1
"1409",9,15,"I would ration supplies and explain the situation to the crew and passangers.",1
"1410",10,15,"Make sure that we ration the food and water to the bare minimum and keep everyone calm by reassuring them that everything will be ok.",1
"1411",11,15,"Try to ration the food and keep calm.",1
"1412",12,15,"tell the passengers the situation, ration meals",11
"1413",13,15,"Tell everyone to start fishing and boiling water so you have food and clean water. ",3
"1414",14,15,"tell them that help will arrive soon and encourage calm",4
"1415",15,15,"Lay out a clear rationing plan. Advise people to stay out of the sun and not drink sea water. Try and set up a way to collect water.",1
"1416",16,15,"I would take all the food supplies under my control and ration them out equally each meal. I would lock the food supply somewhere safe and check to see no one is dehydrated.  ",1
"1417",17,15,"tell them to ration the food until help arrives",1
"1418",18,15,"Explain the situation and ration out of the food accordingly",11
"1419",19,15,"Ration the supplies.",1
"1420",20,15,"I would instruct the crew to keep passengers calm and I would make sure we're rationing food. ",4
"1421",21,15,"I have inform for my superior and convince for all the passengers",-99
"1422",22,15,"Ration the food, give just enough to get by, make it stretch out. I would gather everyone together in person and explain what has happened, explain about the food, explain not to panic that help is on the way. ",1
"1423",23,15,"You have to be honest, nobody is in danger. Make up some fun things to do and offer them free shit.",16
"1424",24,15,"ration food and say calming things to prevent a panic",1
"1425",25,15,"Immediately begin rationing the food and especially the water and enforce it strictly.",1
"1426",26,15,"Take careful analysis of all the factors.",0
"1427",27,15,"I would try to figure out if there is a way to ration the food to keep everyone alive.",1
"1428",28,15,"ask a professional for advice.",10
"1429",29,15,"ration the food out until it gets there",1
"1430",30,15,"I ask everyone to ration the food and water and to work together because it will be a long week and we will need each other's support.",1
"1431",31,15,"Lie to keep everyone calm",7
"1432",32,15,"ration the food",1
"1433",33,15,"Comfort the people",4
"1434",34,15,"tell them the situation, ration food",11
"1435",35,15,"Ration the supplies to last as long as they can.",1
"1436",36,15,"Ration out the food evenly.",1
"1437",37,15,"call the coast guard",6
"1438",38,15,"I would instruct my crew to lock the food supplies somewhere secure until we could come up with a rationing plan",0
"1439",39,15,"ration the food, attend to health and safety of all passengers",1
"1440",40,15,"I would attempt to repair the engine.",15
"1441",41,15,"I would ration the food out and hope help arrives shortly",1
"1442",42,15,"limit food and remain calm and tell the people what is going on",1
"1443",43,15,"explain to them to stay calm and help is coming.  then make sure the food is rationed approprioptly",4
"1444",44,15,"Ration food and tell people to keep calm",1
"1445",45,15,"Ration supplies to make them last; try to keep the passengers entertained in the meantime",1
"1446",46,15,"i need to be direct and say we need to perserve food",1
"1447",47,15,"Call or radio my boss for advice",10
"1448",48,15,"I would start fishing",3
"1449",49,15,"ration suppiles to hol out",1
"1450",50,15,"Explain the situation to everyone, ration food and try to keep people occupied so not to worry.",11
"1451",51,15,"Tell them the situation and ask them to keep calm. Prayers would help.",11
"1452",52,15,"I would ration out the food and hope for the best.",1
"1453",53,15,"I would start taking inventory of all of the food, then would start a plan for rationing.",1
"1454",54,15,"Try to find the nearest port and see if you can ride the current offshore, anchor up and tender people off for a bit",0
"1455",55,15,"Start rationing portions and let the crew know help is on the way but it could take a couple of days.",1
"1456",56,15,"I will try to advise the team to manage with what we have till we get rescue",0
"1457",57,15,"I would do an inventory of all the supplies. Then make a quick accounting of the amount available per passenger. I would explain the situation and what they are allotted to them. ",1
"1458",58,15,"I would make a plan to ration, and i would radio for help to get a supply helicopter to bring more. ",1
"1459",59,15,"I would come up with a plan that structures access and distribution to food supplies.",1
"1460",60,15,"Tell everyone to remain calm, inform people of the situation and that there might be a week wait for rescue. Let them know that food will be rationed out during this period so that everyone can survive the wait. Inform the crew of the plans to ration said food. ",4
"1461",61,15,"I would try my best to explain the situation in a way that would not make them panic too much.",4
"1462",62,15,"Tell them to stay calm and the situation is under control.",4
"1463",63,15,"Make a plan with all involved ",0
"1464",64,15,"The passanger is high rate and good,",-99
"1465",65,15,"Explain to passengers and crew the situation and that food and water should be carefully rationed",1
"1466",66,15,"I would instruct that we need to ration food and everyone should stay calm and know that rescue is on the way",1
"1467",67,15,"Take stock of supplies and ration as needed",1
"1468",68,15,"I would divide the 50 passengers into groups; 5 groups of 10. They will elect the group's leader and I will divide resources among us, entrusting them to each group's leader to use responsibly. ",1
"1469",69,15,"With food being sparce, I would distribute food in a method to assure we can last longer than a week and push a water heavy diet and good resting to maintain our energy and attitudes.",1
"1470",70,15,"Show people how to fish",3
"1471",71,15,"Keep the food and water under my supervision, ration the remaining supplies and find containers to store easch individual's urine.",1
"1472",72,15,"50-passenger cruise ship",-99
"1473",73,15,"I would tell the passengers and crew the details of our predicament and let them know if might be a week before help arrives so we will need to start rationing food.",11
"1474",74,15,"I give some help for engine starting problem.",-99
"1475",75,15,"I would be honest with my crew but tell them we will be okay if we can eat sparingly and stick together as a team, as to prevent chaos and panic.",0
"1476",76,15,"I would announce that we are rationing food over the next week until help arrives.",1
"1477",77,15,"I would have to firstly cut food down to rations, and then explain the situation to everyone and make sure they know this isn't good and if we want to survive we must all work together.",1
"1478",78,15,"Hold a meeting and count supplies ",1
"1479",79,15,"I would take a deep breath and then calculate how many supplies we have and how much we could eat each day to make it last then I would instruct everyone accordingly.",1
"1480",80,15,"I would be honest with both crew and passengers and tell them that we will need to ration food until rescue.",11
"1481",81,15,"First I would check the food supply and start ration it out and try to make it last us for as long as possible and then I would try to keep everyone calm and tell them what is going on.",1
"1482",82,15,"Everyone on board would have to start rationing food.",1
"1483",83,15,"Well firstly, I'd panic. I assume as a trained captain of a cruise ship that there are procedures related to this instance. I guess I would start by rationing the food.",0
"1484",84,15,"tell them to ration food",1
"1485",85,15,"I would be honest with the passengers and work with them to make sure the food will last.",1
"1486",86,15,"I am follow the instruct",-99
"1487",87,15,"tell people they have to rationalize the food.",1
"1488",88,15,"Let them know food will be distributed but it will be limited. There is rescue on the way, so just bare with it for a few days.",11
"1489",89,15,"I explained the situation to crew and asked some ideas",11
"1490",90,15,"I would institute strict rationing and hope for the best.",1
"1491",91,15,"I would take food inventory.",0
"1492",92,15," I would try and manage the remaining food supplies, and tell the fattest passengers to prepare to eat less. A lot less. ",1
"1493",93,15,"Start rationing food and make a plan",1
"1494",94,15,"Set up a daily routine and plan for food rationing.",1
"1495",95,15,"I would think of how to catch fish",3
"1496",96,15,"ration the food",1
"1497",97,15,"I would instruct the crew of the situation, but try to keep the passengers from being too alarmed.  I would ration the dwindling supplies as best as possible.",4
"1498",98,15,"Ration the food supplies, have an assembly where you calmly tell the passengers the truth and ask for help from them, according to their professional knowledge.",0
"1499",99,15,"Let the passengers know the situation and advise of a food rationing.",11
"1500",100,15,"Have a meeting and implement rationing. See if we have fishing equipment. Prepare to gather rain water if possible.",0
"1501",1,16,"Hike back to where you started or find a signal",4
"1502",2,16,"Calling 911 works, unless you have no battery, so I would keep calling until I got an answer. ",4
"1503",3,16,"Give my shirt to Todd for shade and walk to get help.",9
"1504",4,16,"take my shirt off to help shield from the sun",9
"1505",5,16,"Shade Todd the best I can and quickly try to find service.",9
"1506",6,16,"I would go to find water, leaving a trail behind me to get back to him.",5
"1507",7,16,"Try to go get help or find a spot where I have service and then come back for Todd.",4
"1508",8,16,"shelter him in place and leave to find help",1
"1509",9,16,"I would work on freeing his arm.",7
"1510",10,16,"I would go to get help as fast as I could. Being there with them would not help and I would have to go fast. ",1
"1511",11,16,"shelter Todd and go for help.",1
"1512",12,16,"leave Todd with all the supplies and leave him to go get help",1
"1513",13,16,"Find some branches to build a shelter for shade, get him water then a large stick to help pry the crevice open.",9
"1514",14,16,"look on nearby trails to try and find other people who could go get help",1
"1515",15,16,"Leave Todd with fod and water and cover him from the sun then go for help",1
"1516",16,16,"I would leave Todd and walk over to where I get better reception. After I call 911, I would return to where Todd is.",4
"1517",17,16,"walk until i have service",4
"1518",18,16,"leave him with as much supplies as possible and seek help.",1
"1519",19,16,"Find something with which to cover Todd to protect him from sun exposure and the elements, give him whatever rations and water I can spare him of my own supply and then leave to find help, leaving trail markers along the way to find my way back.",9
"1520",20,16,"I try to stay calm and keep Todd calm. If I'm positive I can't help him myself I would move around to try to get service. ",4
"1521",21,16,"I have inform for everyone about the issue",-99
"1522",22,16,"Start walking until you have service or have reached someone who can get help. ",1
"1523",23,16,"I find water for Todd, shelter him from the sun and get help or find a signal",5
"1524",24,16,"might wait until dusk to climb higher and get cell service",14
"1525",25,16,"I'd leave my water with Todd and go for help, all the while checking to see if I now have a cell signal.",1
"1526",26,16,"See if there is water near by.",5
"1527",27,16,"I would try to find somewhere with cell service.",4
"1528",28,16,"try to walk for help",1
"1529",29,16,"try to go get help",1
"1530",30,16,"Tell Todd to hang tight for a minute, and go find a signal for some help.",4
"1531",31,16,"Tell Todd I am going to find help",1
"1532",32,16,"continue helping todd",7
"1533",33,16,"find help",1
"1534",34,16,"help and don't stop helping",7
"1535",35,16,"Try to go up or down the mountain looking for service.",4
"1536",36,16,"Keep trying until you get Todd free.",7
"1537",37,16,"run to get help...or service",1
"1538",38,16,"I would help Todd get as comfortable as possible, then I would begin hiking out until I could get a cell signal",4
"1539",39,16,"travel until I find signal.",4
"1540",40,16,"I would find some ropes to tie around Todd in order to pull him out.",7
"1541",41,16,"I would climb down and try to find help",1
"1542",42,16,"cover him from the sun.  walk till I have cell service and call for help",9
"1543",43,16,"keep trying to get him unstuck and wander off a little to try and find a signal or help",7
"1544",44,16,"Go try to find water then come back to help",5
"1545",45,16,"Try to stay relatively close but see if I can walk around and find service.",4
"1546",46,16,"drink water and get help",7
"1547",47,16,"Leave and look for somewhere with service or find help.",4
"1548",48,16,"I leave for help.",1
"1549",49,16,"walk to were there is service",4
"1550",50,16,"Tell him to stay calm, then cover my head and skin as much as possible and go for help, whether a nearby roadway or back to the original departure point",1
"1551",51,16,"Try to find a signal elsewhere and call for help.",4
"1552",52,16,"I would go to another spot where I can pick up service.",4
"1553",53,16,"I would have no choice but to leave Todd and try to find help or try to get better reception on my cell phone.",1
"1554",54,16,"Keep trying to get it out",7
"1555",55,16,"Keep trying to get his arm out until I do.",7
"1556",56,16,"I will try hold him till we get help",0
"1557",57,16,"I would make Todd as comfortable as possible. Then I would scout about for an area where I could get a cell signal to call for help. ",4
"1558",58,16,"I would get myself to safety and call 911 as soon as possible.",1
"1559",59,16,"I would try to reach an area with service and call 911 again.",4
"1560",60,16,"I would tell Todd to remain calm and wait here whilst I go to find a place where I can get a signal or find help. ",1
"1561",61,16,"I would try to climb down the mountain and see if I could get a signal for my phone.",4
"1562",62,16,"Leave Todd to try to find help.",1
"1563",63,16,"Go find a place with service to call 911",4
"1564",64,16,"The todd is rock and the slips.",-99
"1565",65,16,"I think there'd be no choice but to tell Todd that amputation would be our only option",6
"1566",66,16,"I will stay with him until he decides what is best for him",3
"1567",67,16,"Leave Todd with supplies, and go to get cell reception or help",1
"1568",68,16,"I'd make a shade over Tom, leave him with some water, and go try to find service and help immediately. ",1
"1569",69,16,"I would first tell my friend I am not leving him but need to see if we can get reception in a better location fast. I would be gone no longer than 10 minutes. If this didn't work I would then return and work out ways in which could get him free and or out of the crevice.",4
"1570",70,16,"Keep working to free him",7
"1571",71,16,"Leave on foot and try and get help.",1
"1572",72,16,"Todd's arm out of the rock",-99
"1573",73,16,"I'd make sure Todd was not in immediate danger and attempt to move into cell tower range and call for help",4
"1574",74,16,"I reach the near people help",-99
"1575",75,16,"I would try longer to free his arm. If we really could not free him, I would mark our exact location on my phone and travel alone until I found service and could reach help successfully. Once I reached 911 and was sure they were coming, I would return to my friend and wait with them. Or, I would wait where 911 could find me easily and lead them to my friend.",7
"1576",76,16,"I create a SOS with land markers or rocks if able. Afterwards, I travel down the mountain to try to get service. When I finally get a call for help I come back up to my friend to wait with them. I'd do my best to help them avoid too much skin exposure to the sun.",8
"1577",77,16,"The drastic part of this is us dying from dehydration, it is a long way down so if we are to high up to get help then I might have to cut his arm off.",6
"1578",78,16,"Possible break his arm to get it out or go get help and come back",6
"1579",79,16,"I would try to walk a little in both directions to try to get signal if I was unable to get signal I would tell Todd that I need to go for help.",4
"1580",80,16,"I would cover Todd with jacket, etc., to keep him from sun exposure and keep moving about until I got cell phone service.",9
