"","id","context","text","group"
"310",10,4,"I would wait for them to get there and tell them about it. I am sure that they would understand",6
"311",11,4,"use phone at the gym to call friend.",2
"312",12,4,"wait for my friend to arrive and talk to him when he gets there",6
"313",13,4,"Renew your membership.",1
"314",14,4,"wait for them and try to go in together so they don't notice",0
"315",15,4,"Explain the situation to the receptionist. See if they'll give me a guest pass for the day and if not, ask for an escort to go inform my friend",0
"316",16,4,"I would wait for my friend and tell him I can't play racquetball today because I hurt my back. I would then suggest we go have lunch somewhere. Then later, I would renew my membership and call my friend to re-schedule.",0
"317",17,4,"renew membership at front desk",1
"318",18,4,"arrive before the friend and explain the situation",0
"319",19,4,"Renew my membership on the spot.",1
"320",20,4,"I would see if I could renew my membership. ",1
"321",21,4,"I have tell for my situation in the gym owner",0
"322",22,4,"I would renew my membership. If that wasn't possible I wait for my friend at the desk or the door. If they had already entered I would have them called to the desk or ask someone going into the gym to have my friend come outside. ",1
"323",23,4,"Leave a message for when he checks in, Ask the gym to call him",10
"324",24,4,"i might re-up my membership",1
"325",25,4,"I'd leave a message with the gym staff, return to the office and call my bud from there.",0
"326",26,4,"Ask to borrow someone's phone.",3
"327",27,4,"I would buy a new membership.",1
"328",28,4,"renew my membership",1
"329",29,4,"ask to use the phone",2
"330",30,4,"I will talk to the desk agent and get a day pass so I can play with my friend.",8
"331",31,4,"Renew my membership",1
"332",32,4,"let the desk know ",13
"333",33,4,"buy a membership",1
"334",34,4,"ask gym to use phone",2
"335",35,4,"Wait for the friend to show up.",6
"336",36,4,"Ask staff to deliver the message.",10
"337",37,4,"leave a message at the gym desk",10
"338",38,4,"I would ask the gym employees to pass the message along",10
"339",39,4,"renew membership",1
"340",40,4,"I would borrow a phone to call my friend.",3
"341",41,4,"I would just renew my membership",1
"342",42,4,"wait outside till he arrives.",6
"343",43,4,"try to ask someone going in to let them know or tell them the situation and see if they will let you in",0
"344",44,4,"Leave and tell them later",11
"345",45,4,"Ask the receptionist at the gym if I can use the phone to call my friend; barring that I'd leave a note for them",2
"346",46,4,"wait for friend to show or let the front desk charge the card on file",6
"347",47,4,"Go up to the gym desk and renew my membership",1
"348",48,4,"Buy a new membership, since I am likely to anyways.",1
"349",49,4,"tell  them when they arrive",6
"350",50,4,"Have someone go find the friend, but in the meantime renew my membership so I can continue to play racquetball.",0
"351",51,4,"Ask to borrow a phone to call him.",2
"352",52,4,"Have the friend paged and then let him know the problem.",13
"353",53,4,"I'd talk to the front desk and see if they could contact the person to talk to them.",13
"354",54,4,"Pay the daily fee or wait for friend and explain the situation ",8
"355",55,4,"Ask someone at the gym can you borrow their phone and or check with the gym owner to see if you can use theirs.",3
"356",56,4,"I will just go back to work",9
"357",57,4,"I would renew the membership and enter the gym to play with the friend who is waiting for me. ",1
"358",58,4,"I would ask the front desk if they could call him, or i would wait until he arrived to let him know. ",13
"359",59,4,"I would ask if I could go in quickly or if somebody could pass a message to my friend.",0
"360",60,4,"Ask the people at the gym if they can inform your friend. See if I can renew my membership whilst I am there. ",13
"361",61,4,"I would wait there until my friend got there and depending on the price, I may renew the membership.",6
"362",62,4,"Wait for your friend and decide what to do from there.",6
"363",63,4,"Go back to the office and call my friend ",12
"364",64,4,"The office is the desk on the phone in my friend,",-99
"365",65,4,"I'd pay the membership fee and go into the gym",1
"366",66,4,"I'll have to go back and explain what happened",0
"367",67,4,"Ask gym staff to let your friend know",13
"368",68,4,"I'd wait until my friend came and tell them. ",6
"369",69,4,"I would pay for the day to hang with my friend, and or reinstate my membership.",8
"370",70,4,"Pay for the membership.",1
"371",71,4,"Buy a new membership or wait out front for my friend to arrive.",1
"372",72,4,"next day in gym",-99
"373",73,4,"Leave a note with the person at front checking in members and letting my friend know the situation.",10
"374",74,4,"I cancel the plan",0
"375",75,4,"I would wait at the gym for my friend to arrive and let them know. or, I would pay the membership fee if I were able to at the time.",6
"376",76,4,"I'd try to renew my membership before my friend got there. If that wasn't an option I'd try to borrow someone's phone at the gym.",1
"377",77,4,"I would just not go, and tell him the truth the next day when I get my phone.",11
"378",78,4,"Ask the gym to inform my friend ",13
"379",79,4,"I would ask the receptionist at the gym if they could locate my friend and pass on the message. ",13
"380",80,4,"I would ask the person at the desk to notify my friend and/or renew my membership on the spot.",13
"381",81,4,"I decide to go pay for my membership so that I can play racquetball with my friend even thought I have to ask him for the money since I left my things behind.",0
"382",82,4,"I would try to renew my membership and wait for my friend to arrive.",1
"383",83,4,"I would go back to the office and text my friend about the situation and apologize profusely for standing them up. ",12
"384",84,4,"Unsure what to do",-99
"385",85,4,"I would ask if he is there already and if not wait for him to get there.",0
"386",86,4,"I am calling to landline",-99
"387",87,4,"try to sneak in the gym",5
"388",88,4,"Ask to borrow a phone and see if anyone will lend theirs to me for a moment.",3
"389",89,4,"I back to desk in office after that I informed to him",-99
"390",90,4,"I would leave and call my friend later to explain.",11
"391",91,4,"I would wait for my friend and pay for one day or renew my membership..",6
"392",92,4,"I would go the gym regardless.",0
"393",93,4,"Wait for him to show up and ask for a one time pass",8
"394",94,4,"Go home and wait until the next day to apologize to my friend.",11
"395",95,4,"I would borrow a phone",3
"396",96,4,"buy another membership since you like going ",1
"397",97,4,"Wait for my friend to get to the gym and explain the situation",6
"398",98,4,"Buy a new membership, meet my friend.",1
"399",99,4,"Wait outside for him to show up or ask someone to use their phone.",6
"400",100,4,"Ask the gym desk if your friend is already there or not, if so ask to send a message to them if not then wait by the door to catch them. Or, pay for the membership on the spot. ",13
"401",1,5,"Explain to the teacher and ask for an extra day",9
"402",2,5,"I tell them to call my mom, so I can turn in my homework assignment.",2
"403",3,5,"Go to the office and call home, then have mom call the teacher.",2
"404",4,5,"explain to the teacher",1
"405",5,5,"Explain to the teacher what happened.",1
"406",6,5,"Ask the teacher to call my mom.",2
"407",7,5,"Talk to my teacher and ask if I can bring it the next day",9
"408",8,5,"I would explain the situation to the teacher",1
"409",9,5,"I would explain the situation to my teacher. Then I would ask the office to call my mom. Although, in this scenario I am an elementary school student so I may just cry.",0
"410",10,5,"I would tell the teacher what happened and just accept it. ",1
"411",11,5,"call my mom and tell teacher about it.",2
"412",12,5,"tell my teacher the truth and turn in my homework tomorrow",0
"413",13,5,"Call Mom and ask her to bring the assignment.",2
"414",14,5,"tell the teacher what happened and call my mom to bring it ",1
"415",15,5,"Explain the situation to my teacher and ask to turn it in tomorrow",9
"416",16,5,"I would tell my teacher, and have my mom write a letter to my teacher. I would try to remember my answers to my assignment and try to put down as much information that I can remember.",0
"417",17,5,"tell the teacher to call mom",2
"418",18,5,"explain to the teacher what happened ",1
"419",19,5,"Contact my mother to see if she can bring the homework assignment or ask for a pass to go home to get it and bring it back.",2
"420",20,5,"I would explain what happened to my teacher. ",1
"421",21,5,"I have tell the information for my teacher and excuse for one day",9
"422",22,5,"I would call my mom and ask her to bring it to the school. If she weren't I would see if there was some way the teacher could talk to my mother on the phone and get an explanation. I would make sure the teacher knew up front why I didn't have the work. ",2
"423",23,5,"Im in elementary school so probably make up a story about some gang members that demanded my homework and I had to beat them all up and during the melee I lost it.",7
"424",24,5,"talk to the teacher about the misunderstanding and see if she would call my mom for me",2
"425",25,5,"Explain the situation to the teacher and suggest she call my mom to check my story.",1
"426",26,5,"Tell the teacher as soon as I arrived.",1
"427",27,5,"I would explain what happened to my teacher and have her ask my mom to confirm the story.",1
"428",28,5,"try to call my mom",2
"429",29,5,"tell the teacher the truth",1
"430",30,5,"I tell the teacher that I completed the assignment and I ask to call my mom so she can send a photo of it to my teacher's email.",1
"431",31,5,"Take the loss",5
"432",32,5,"explain the situation ",1
"433",33,5,"call mom",2
"434",34,5,"tell my teacher, call my mom",2
"435",35,5,"Call my mom and have her bring it.",2
"436",36,5,"Tell the teacher the truth and ask to call your mom.",2
"437",37,5,"tell the teacher the situation ",1
"438",38,5,"I would talk to my teacher and explain the situation",1
"439",39,5,"ask if I can turn it in late.",9
"440",40,5,"I would explain myself to the teacher.",1
"441",41,5,"I would tell the teacher and have her call my mom to bring if or see if I can bring it in the next day",0
"442",42,5,"Explain it to teacher and hope Mom can get the paper to you before end of day.",1
"443",43,5,"tell your teacher and ask if you can bring it tomorrow",9
"444",44,5,"Explain my situation to the teacher",1
"445",45,5,"Tell the teacher that my homework is at my house, because my mom took it out of my backpack and I will turn it in tomorrow",1
"446",46,5,"just go to class and ask if you can turn it in tomorrow ",9
"447",47,5,"Tell the teacher what happened and ask if you can call your mom to bring the assignment in or ask if I can turn it in tomorrow.",1
"448",48,5,"Turn nothing in who cares?",5
"449",49,5,"explain to teacher",1
"450",50,5,"I would explain the situation to the teacher and ask to call my mother to bring the homework to my school",2
"451",51,5,"Call mom once I get to school and see if she can deliver it.",2
"452",52,5,"Explain to the teacher what happened and hope she is understanding.",1
"453",53,5,"I would ask the teacher if I could call my parents to bring my homework to school so that I could pass it in.  Or else ask if I could bring in a note the next day from my parents.",2
"454",54,5,"Tell the teacher what happened",1
"455",55,5,"Call my mom and see if she can bring it to the school before the day ends.",2
"456",56,5,"I will go back home to try to look for it or ask for a retake",8
"457",57,5,"Explain to the teacher that I did the assignment but left it at home. I would ask if my mom could send a screen shot of it to me. ",1
"458",58,5,"I would probably cry, and then tell my teacher what happened or go to the office and ask to call her and talk to my teacher. ",10
"459",59,5,"I would explain my teacher what happened and I would reach out to my mother.",2
"460",60,5,"Explain what happened to my teacher. ",1
"461",61,5,"I would tell my teacher the situation and ask if I can go to the office to call my mom to bring it.",1
"462",62,5,"I would explain to my teacher what happened.",1
"463",63,5,"Let the teacher know what happened ",1
"464",64,5,"The credit is high  and good.,",-99
"465",65,5,"I'd explain to the teacher and have her call home to confirm this and get the assignment turned in.",0
"466",66,5,"I would tell my teacher to call my mom and ask her to bring in the homework",0
"467",67,5,"Try to see if she can bring it to school.",2
"468",68,5,"I would tell the teacher what happened And just hope for the best. ",1
"469",69,5,"I would tell the teacher about this, and to fully confirm it have them email my mom to check for my story.",1
"470",70,5,"Call Mom",2
"471",71,5,"Go to the office and ask to call my mother and have her bring the assignment.",2
"472",72,5,"no decide",-99
"473",73,5,"I would let the teach know what happened and have the school call my mother and bring the assignment to school.",0
"474",74,5,"go to the school",0
"475",75,5,"I would tell my teacher I did my homework but mom forgot to put it back in my back when she was packing my bookbag and tell teacher she can call mom to confirm it was done on time, or ask the teacher for another worksheet and tell her I'd fill it out again in time for class.",1
"476",76,5,"I would talk to my teacher about my situation and have my mom confirm. I'd also take photo evidence and send it to my teacher asap as proof.",0
"477",77,5,"I would simply tell the teacher the truth, that I do not have my assignment because my mother took it out of my bag.",1
"478",78,5,"Tell my teacher to call my mom",0
"479",79,5,"I would explain the situation to my teacher and tell my teacher if they didn't believe me to contact my mother.",1
"480",80,5,"I would tell the teacher and have him/her call my mom to verify.",1
"481",81,5,"I hurry up and go to the office and ask them if I can use their phone to call my mom to bring my homework assignment so I don't get a bad grade.",2
"482",82,5,"I would try to explain the situation to my teacher and turn my assignment in the next day.",9
"483",83,5,"I would explain to the teacher exactly what had happened. As an elementary student I may not realize that I am responsible for looking in my backpack before school and I may not ask the teacher for an extension.",1
"484",84,5,"Unsure what to do",-99
"485",85,5,"I would explain to the teacher and ask to call my mom to deliver it.",2
"486",86,5,"next time I am first say my mom",-99
"487",87,5,"tell the teacher the situation ",1
"488",88,5,"Tell the teacher what has happened and offer to call mom to bring it in.",1
"489",89,5,"I was punished",-99
"490",90,5,"I would tell the teacher the truth.",1
"491",91,5,"Explain what happened to my teacher and offer to call home to see if my mom could bring it to me.",1
"492",92,5,"Make something up to pass as a homework assignment ",3
"493",93,5,"Let the teacher know what happened and tell her my mom will corroborate the story",1
"494",94,5,"Request to phone my mother to drop off the assignment to school.",2
"495",95,5,"I will call my Mum and ask her to send it over",2
"496",96,5,"let the teacher know and call your mom to bring it up to school",2
"497",97,5,"Try to call my mom.  Explain to the teacher what happened.",2
"498",98,5,"Tell the teacher the truth and ask if your mom can bring it in, the assignment.",1
"499",99,5,"Let the teacher know to see if it can be turned in late otherwise call mom!",9
"500",100,5,"Ask to call your mom for an emergency.",2
"501",1,6,"Stop and make shelter",4
"502",2,6,"I decide to stay put until the search team comes. I will do everything I can to stay warm and hydrated until then.",4
"503",3,6,"Start a fire and build some shelter.",1
"504",4,6,"wait it out",0
"505",5,6,"Ration the food and water, look for wild food and water sources, and huddle together in a small makeshift shelter to keep warm.",12
"506",6,6,"I would try to find leaves and ground to cover myself in to stay warm and make signs for rescuers to follow with twigs, leaves and branches.",4
"507",7,6,"Try to build a fire and light any flares we may have.",9
"508",8,6,"find shelter to warm up to help conserve energy",1
"509",9,6,"I would create a signal fire.",9
"510",10,6,"I would decide to try and make a fire and make some smoke and try to get warm.",9
"511",11,6,"Try to make shelter and wait.",4
"512",12,6,"stay in one spot, build a fire and wait for rescue",4
"513",13,6,"Find a clearing and light a fire away from the trees.",9
"514",14,6,"try to find shelter in a cave to hunker down in",0
"515",15,6,"Pool resources and ration food. Start a fire and wait for rescuers",12
"516",16,6,"I would hide the food and water somewhere so that I can eat and drink them later",0
"517",17,6,"use the position of the sun to find my way back",7
"518",18,6,"Try to make a shelter and fire to help alert someone. Try and find some water if possible.",9
"519",19,6,"Light a smokey campfire to attract help. Find a flowing body of water (stream, river) and follow it and use it for drinking water. Try to find shelter.",9
"520",20,6,"I would try to make a fire and stay in one place so it would be easier for the rescue team to find me.",9
"521",21,6,"I have try to rescue for this place",-99
"522",22,6,"Stay put and try to stay warm the best way I could. Going further may prolong the rescue.",4
"523",23,6,"I find water immediately, secure shelter, build fire.",14
"524",24,6,"stay still and make a base camp",4
"525",25,6,"Stay in place and build a fire, the bigger the better to attract attention and drink melted snow when the water runs out.",9
"526",26,6,"Build a big fire somehow.",1
"527",27,6,"I would try to stay find the warmest spot close by and set up a camp there.",4
"528",28,6,"try to use my cell to call for help",2
"529",29,6,"stay as warm as possible",0
"530",30,6,"Tap into the survivalist in me and live off the land until help arrives.",6
"531",31,6,"Try to scavenge for food",6
"532",32,6,"wait for help",4
"533",33,6,"Wait it out",4
"534",34,6,"make a fire",1
"535",35,6,"Stay in one place and find shelter.",4
"536",36,6,"Find and/or build shelter and fire.",1
"537",37,6,"start a fire and hunt",1
"538",38,6,"I would stay put, since I know that is usually the best idea, and would do my best to build some kind of shelter",4
"539",39,6,"get to a high point, figure out location from there, work way back.",7
"540",40,6,"I would find a way out of the wilderness using my survival skills.",7
"541",41,6,"Find a way to make shelter and hold out until help arrives",4
"542",42,6,"find some water and leaves,  sleep with leaves and stay close to the water.",0
"543",43,6,"ration food and water to each of us",12
"544",44,6,"Try to find shelter",0
"545",45,6,"Ration the food and water and try to build a shelter",12
"546",46,6,"I would just be freaking out",0
"547",47,6,"Find the best possible place to stay, and don't move from that area.",4
"548",48,6,"Check which direction the moss on the trees is facing, as it usually faces north.",7
"549",49,6,"call for rescue",2
"550",50,6,"Find the warmest place possible, ration food and try to build some sign to get noticed.",12
"551",51,6,"If it's early in the day-trying to head in one direction to find a road. If it's late, try to make a shelter as best we can and start the next morning.",0
"552",52,6,"I would stay put and let the rescue crew find me.",4
"553",53,6,"I would start by making a structure for warmth, then a fire, and then start some basic hunting and gathering to get food.  If its cold, there must be snow or some other type of water source to get water.",4
"554",54,6,"Stay put, make shelter and try to find water",4
"555",55,6,"Try to stay close to where I am so I don't go further into the wilderness.  Take any extra clothes and socks we may have and use them to keep warm.",4
"556",56,6,"Try call for help",2
"557",57,6,"Use the energy I have now to collect fire wood and scout the area for edibles. Build a make shift camp and stay in place. ",1
"558",58,6,"Get to a clearing that is viable from up top, light a fire to send a signal, do anything i can think of to stay warm.",9
"559",59,6,"I would hold on until the rescue crew shows up, strictly rationing supplies.  ",12
"560",60,6,"Try and stay calm, do not venture too far from the spot to avoid getting even more lost. Try to limit food and water consumption as much as possible. See if there is a water source nearby and try and find shelter to stay warm.",4
"561",61,6,"I would have us stay in one spot and try to keep each other warm.",4
"562",62,6,"Try to draw attention to yourself so the rescue crew can find you.",9
"563",63,6,"Try to signal the rescue crew",9
"564",64,6,"The water take in few times.",-99
"565",65,6,"I'd construct a temporary shelter and make smoke signals",9
"566",66,6,"huddle together for warmth and try to find any animals for food",6
"567",67,6,"Take stock of supplies, asses how long they will last for, and see what methods you have to signal rescue parties",0
"568",68,6,"I would start to make a space where I can attempt to get away from the elements first, like a lean - to. Then I'd attempt to make a fire to stay warm and for signaling help. I would try to ration my food to the extreme, and wait for a search crew m",0
"569",69,6,"Focus on building something for us to reside in and build a fire to retain our heat, and then look for methods to acquire water.",4
"570",70,6,"Stay put and huddle together",4
"571",71,6,"All of us head in a straight line to the direction we think is the best guess.",7
"572",72,6,"no decide ",-99
"573",73,6,"Stay where we are, create as much shelter as possible and wait for rescue.",4
"574",74,6,"First I stay clam and cool. Any help way to try it. ",4
"575",75,6,"There isn't much one can do, other than do the very best they can to survive. I would try to keep everyone calm to prevent panic. I would start a fire. If we are days into a trip, we have a tent and overnight gear. We will have to eat less and wait for help. ",4
"576",76,6,"I would try to secure shelter and find a water source while waiting for the rescue crew. It would at least prolong my survival.",14
"577",77,6,"Again we would have to ration food and water, and work as a team. We must build adequate shelter and huddle for warmth while we wait for rescue.",12
"578",78,6,"Call for help ",2
"579",79,6,"I would attempt to call emergency services and I would hunker down somewhere because continuing to walk around lost id just going to cause us to consume more energy and resources ",2
"580",80,6,"Conserve food, water.  Take any emergency measures.  Pray.",12
"581",81,6,"I would make a fire and try to conserve energy plus keep everyone warm too!",1
"582",82,6,"I would try to find a source of water and wait for rescue.",14
"583",83,6,"I guess I would try to huddle up with the friend for warmth and wait out the rescue crew.",4
"584",84,6,"stop and help",0
"585",85,6,"I would stay in one spot and wait to be rescued.",4
"586",86,6,"I complete my way",-99
"587",87,6,"try to rationalize the food",12
"588",88,6,"Bundle up with friends to split food and share warmth. Try to find a decent location to camp it out at.",4
"589",89,6,"I had a self confidence and I try to find another way",7
"590",90,6,"I would stay put and wait for rescue, and I would try to keep a fire burning.",4
"591",91,6,"I would gather wood and make emergency shelter with tree branches.",4
"592",92,6,"Try and light a flare.",9
"593",93,6,"Stay put and ty to stay warm waiting for the rescue team",4
"594",94,6,"Find shelter and stay put for as long as possible ",4
"595",95,6,"I would call the other crew",2
"596",96,6,"call 911",2
"597",97,6,"Try to search for food/water and get to a point where the rescue crew could find us quickly",6
"598",98,6,"Use everything you have to try to signal your location for the inevitable search parties.",9
"599",99,6,"Look for nearest shelter and leave an obvious trail.",0
"600",100,6,"review maps and decipher the correct location",7
"601",1,7,"Say ""sorry Ted""",1
"602",2,7,"I would sell my ticket so my friend wouldn't have to miss out on the concert alone.",0
"603",3,7,"Give Ted my ticket ",4
"604",4,7,"try to sneak in",6
"605",5,7,"Hangout somewhere else with Ted.",2
"606",6,7,"I would ask if there were any more tickets available.",5
"607",7,7,"Look for people selling tickets outside the concert or try to find one online.",5
"608",8,7,"tell ted to run",0
"609",9,7,"Offer to loan money to Ted to buy another ticket and then ask why he doesn't have a ticket on his cell phone in 2021. Seriously.",5
"610",10,7,"I would likely go with him home and miss the concert. Then have him pay for the next one we go to.",0
"611",11,7,"Give him my ticket and go get his.",0
"612",12,7,"look for a ticket scalper and pay for a ticket for my friend",5
"613",13,7,"Let him go back and get his ticket. We will see him at our seats.",1
"614",14,7,"Try to figure out how to get him in without a ticket",0
"615",15,7,"Check with the venue to see if they have any way of finding the ticket in their system",7
"616",16,7,"I would suggest we do something else, like go to a bar instead.",2
"617",17,7,"buy a new ticked online or at the front",5
"618",18,7,"Try and buy another ticket at the show",5
"619",19,7,"I would advise Ted to see if he can purchase another ticket from a scalper.",5
"620",20,7,"I would offer to pay for another ticket if he didn't have the money. ",5
"621",21,7,"I have purchase for another some ticket",5
"622",22,7,"The price of tickets are expensive, so buying another one would be pointless. I would offer to take Ted back and would miss some of the concert with them.",3
"623",23,7,"We buy him a ticket",5
"624",24,7,"look for a scalper",5
