"","id","context","text","group"
"625",25,7,"Maybe Ted could call someone from home to bring him the ticket and we could meet at a point halfway, so Ted would still see most of the concert.",11
"626",26,7,"Ask around for a ticket if not too expensive.",5
"627",27,7,"I would ask everyone to pool some money together to get a new ticket for him.",5
"628",28,7,"not go in without him",0
"629",29,7,"pitch in to buy him a ticket",5
"630",30,7,"Explain the situation to a sympathetic guard and get Ted in.",7
"631",31,7,"Try to get another ticket",5
"632",32,7,"continue to the concert",1
"633",33,7,"buy another ticket",5
"634",34,7,"Go without him",1
"635",35,7,"See if you can buy a new ticket.",5
"636",36,7,"Go with Ted to get his ticket.",3
"637",37,7,"sorry ted...",1
"638",38,7,"It would be silly for all of us to miss the concert and waste our money, so I would tell tell to hurry back and get it, or else look around for a scalper",0
"639",39,7,"Offer my ticket.",4
"640",40,7,"I would attend the concert without Ted.",1
"641",41,7,"Buy another ticket at the box office ",5
"642",42,7,"go home with ted and come back with his ticket.",3
"643",43,7,"leave with Ted to go get his ticket then go back together",3
"644",44,7,"Drive him home quickly to get it",3
"645",45,7,"Buy Ted another ticket and have him reimburse me later",5
"646",46,7,"ask if someone is home so they can bring it to him",11
"647",47,7,"See if we can find a ticket scalper and pitch in to help Ted buy a new ticket",5
"648",48,7,"Have someone bring it to him if possible",11
"649",49,7,"see if ticket window has any records",0
"650",50,7,"If it's not too expensive, buy an additional ticket and offer to pay for part of it so you can both attend",5
"651",51,7,"Give him my ticket and wait outside.",4
"652",52,7,"I would offer to loan him money for a new ticket",5
"653",53,7,"Buy Ted a ticket in a random section and then figure out a way to sneak him in to the seats that we have.",0
"654",54,7,"See if the ticket office could look up his ticket. If not, I would go to the concert",7
"655",55,7,"Go and watch the concert and let him go home and get the ticket.",1
"656",56,7,"Try buy another ticket at the door",5
"657",57,7,"I would go to the concert and record it for Ted so he can watch it if he doesn't make it back in time. ",1
"658",58,7,"I would feel bad for Ted but would still go in, maybe help buy a replacement ticket if available. ",5
"659",59,7,"I would try to buy a new ticket for him.",5
"660",60,7,"See if Ted can buy a ticket at the door. If not then see if someone can bring the ticket to the venue so that Ted can at least catch some of the concert. ",5
"661",61,7,"I would pitch the idea that we all chip in to buy another ticket for him there.",5
"662",62,7,"Buy his ticket for him.",5
"663",63,7,"Nothing",0
"664",64,7,"The like and ted on the returns,",-99
"665",65,7,"I'd ask Ted if he wants me to go back with him to his house and if we miss the concert then oh well we can go do something else",3
"666",66,7,"I would suggest he try to find an extra online",0
"667",67,7,"Go to the concert without Ted",1
"668",68,7,"I'd tell Ted he can take my car back to the house to get his ticket but that I am already angry about the situation and don't want to miss the show. ",14
"669",69,7,"If this was the case, I would see if we can show the entrance staff he bought the ticket with his receipt online and showcase that, otherwise I would be willing to give up my ticket to him.",7
"670",70,7,"Go into the concert while he goes to get his ticket.",1
"671",71,7,"See if another ticket is available at the box office. If not, sorry Ted, I'm going in.",5
"672",72,7," friend Ted realizes he forgot his ticket at his house",-99
"673",73,7,"Ask Ted if there is someone he can call to bring the ticket and then offer to miss the concert with him",11
"674",74,7,"call and stop it",-99
"675",75,7,"I would return with him for his ticket and we would see what we could of the concert together. If that were not an option, I would sell my ticket to someone outside of the theater and take the loss. I would not want to go alone, without my friend. That would be unkind to my friend and not very much fun for me either.",3
"676",76,7,"I would give my friend my ticket and tell him he owes me one.",4
"677",77,7,"I would say that Ted should go back and get his ticket, he forgot it and I do not see them letting him into to concert without it.",1
"678",78,7,"Help Him buy another ticket",5
"679",79,7,"I would give Ted my ticket and I would skip out.",4
"680",80,7,"If tickets are available, have Ted and/or friends purchase another ticket.  Other than that, that is Ted's problem.",5
"681",81,7,"I would throw him the keys and tell him to go get his ticket and get back to the concert I will save you a spot man!",1
"682",82,7,"I would wait for my friend to retrieve the ticket himself or have someone bring the ticket to him.",0
"683",83,7,"I would tell Ted to drop us at the concert and go get his ticket, this is why you ensure you have these things before leaving your house.",1
"684",84,7,"get the ticket",3
"685",85,7,"I would buy him another ticket.",5
"686",86,7,"Don't forgot the ticket at any time",-99
"687",87,7,"try to sneak ted in ",6
"688",88,7,"It was his responsibility and I have my ticket. So I would proceed to go in.",1
"689",89,7,"I buy another tickets",5
"690",90,7,"II would go in the concert and hope Ted doesn't miss too much of it.",1
"691",91,7,"Offer to buy Ted a ticket if I had the money.",5
"692",92,7,"return and get the ticket. ",3
"693",93,7,"Try to find a scalper close by and go to the concert with or without him",5
"694",94,7,"Give him my ticket.",4
"695",95,7,"Pay for another ticket",5
"696",96,7,"Let him go get it and I stay there",1
"697",97,7,"See if there were any tickets available and buy him one but have him reimburse me",5
"698",98,7,"Skip the concert, go out to eat with Ted.",2
"699",99,7,"Tell Ted I will video the concert and he should really hurry to get his ticket.",0
"700",100,7,"Ted has to go get his ticket, or call home to see if someone can bring it.",0
"701",1,8,"ignore",4
"702",2,8,"I would get the families attention while stopping the teenager.",8
"703",3,8,"Walk over and ask if they are with the family, if yes, then I would ask that we walk down to make sure.",2
"704",4,8,"alert the authorities",11
"705",5,8,"Ignore them.",4
"706",6,8,"I would ask the teenager if his parents were around.",2
"707",7,8,"Mind my business unless I was 100% positive he was not a member of the family.",0
"708",8,8,"I would say hello to them and see how they react",2
"709",9,8,"I would yell at the teenager and ask Loudly, ""Are you supposed to be going through that bag?""",3
"710",10,8,"I would just carefully watch and be ready to act if I needed to. Also taking care of what judgment I would make. ",6
"711",11,8,"I would do nothing.",4
"712",12,8,"ask the teenager what he's doing, possibly yell so the family looks over",0
"713",13,8,"Say ""Hi, are you part of the group?""",2
"714",14,8,"go get the people and let them know",1
"715",15,8,"Keep an eye on him",6
"716",16,8,"I would not do anything.",4
"717",17,8,"mind my business",4
"718",18,8,"confront him in a friendly manner and figure out his motive",2
"719",19,8,"I would keep an eye on the teen and inform the family when they return from the water.",0
"720",20,8,"I would wait to see what the teenager does and if it looks like he is stealing I would call out to him. ",6
"721",21,8,"I have carefully watched him.",6
"722",22,8,"Go to one of the parents and explain that I wasn't sure if the teen was a part of their party that I didn't recall seeing them together. I would definitely bring it to their attention.",1
"723",23,8,"""I didn't see you with that family earlier. Are those your things? If gthey're not you better get somewhere else before I stand up!""",2
"724",24,8,"i'd ask him what he was doing",2
"725",25,8,"I'd nonchalantly go over to the family and bring this to their attention, quickly before he takes anything and gets away.",1
"726",26,8,"Just make mental notes and keep an eye on him.",12
"727",27,8,"I would say something to them and see what their reaction is.",2
"728",28,8,"tell them",1
"729",29,8,"ask if he is with them",2
"730",30,8,"I ask him what is he doing and alert the family to his presence. If he doesn't know them, it's time for some sweet chin music.",0
"731",31,8,"Nothing",4
"732",32,8,"ask the teen what they are doing",2
"733",33,8,"Nothing",4
"734",34,8,"talk to the mom, get her attention",1
"735",35,8,"Go tell the family that someone is in their things.",1
"736",36,8,"Start a conversation with the person.",2
"737",37,8,"aske her her business",2
"738",38,8,"I would bring it up with the people around me and get their judgments",15
"739",39,8,"nothing",4
"740",40,8,"I would have to ignore the teen, because there is no crime being committed.",4
"741",41,8,"I would ignore the situation",4
"742",42,8,"Ask him or go to water and ask the family",2
"743",43,8,"I'd say loudly is that your belongings?",2
"744",44,8,"Approach him and ask why",2
"745",45,8,"Keep an eye on the teenager just to make sure what it is going on; I'm not going to confront somebody who may indeed be part of the family",6
"746",46,8,"i dont get involved ",4
"747",47,8,"I may try to secretly get a photo of them in case it's needed for evidence later, but otherwise do nothing.",9
"748",48,8,"Approach and ask.",2
"749",49,8,"go up and queitly ask them",2
"750",50,8,"Ask the teenager if those are his belongings or suggest he move along.",2
"751",51,8,"""Hey. I don't think you're a part of that clan!""",3
"752",52,8,"I would do nothing.",4
"753",53,8,"I would walk over to the person and see if they looked at me nervously.",0
"754",54,8,"Watch and see if he takes anything and walks away. If he does shout to the family",6
"755",55,8,"I might ask, is that your family who went in the water, you look familiar.",2
"756",56,8,"I will try and get one of the members of the family to come and confirm ",1
"757",57,8,"I would ask the teen if his family was having a good day at the beach and then for their name. Hoping to get them to leave if they don't belong. ",2
"758",58,8,"I would confront the teenager, if he seemed untrustworthy i would go tell the family",2
"759",59,8,"I would ask the teenager what he/she is doing.",2
"760",60,8,"I would likely do nothing in this situation as I can not ascertain if the teenager is part of the family or not. ",4
"761",61,8,"I would say his family looks like a nice group of people, and see what his response is. ",2
"762",62,8,"Ask him what he's doing.",2
"763",63,8,"Go and ask the family if they know the teen ",1
"764",64,8,"The family take in water.",-99
"765",65,8,"I'd carefully monitor the situation and if nothing nefarious seems afoot then I'd leave it be. If not I'd alert the family somehow",6
"766",66,8,"I would let the family know when they get back",0
"767",67,8,"Keep an eye on the individual, and determine if they are with the group or not",6
"768",68,8,"I'd leave it alone and mind my own business. ",4
"769",69,8,"I would watch them closely, and if they look suspicions take video or pictures of him and even ask how he knows the family. fake being a family friend to fake out the teenager.",0
"770",70,8,"I would ask them what they are doing.",2
"771",71,8,"Walk over and try to make inconspicuous small talk until the family returns.",2
"772",72,8,"beach next to a family with young children",-99
"773",73,8,"Ask the teenager what they are doing",2
"774",74,8,"I accepted",-99
"775",75,8,"I would approach the family and say, ""this is a little awkward, but is that person a part of your family? I just wanted to make sure because they are going in your bags when you walked away and it could be family but on the chance it isn't, I would want someone to tell me. I hope I don't offend anyone...""",1
"776",76,8,"I ignore it and assume that the teenager is a part of their family or friends.",4
"777",77,8,"I would confront the teenager and ask if they are with the family. If yes I would confront them, if no I would find the beach patrol and get him kicked off the beach.",0
"778",78,8,"Observe the tennager ",6
"779",79,8,"I would keep an eye on the teenager to see where he goes and when the family returns I would mention it to them,",6
"780",80,8,"I would ask regardless.  If he is a thief, that might be enough to make him run away.",2
"781",81,8,"I would kindly go up to the child and ask her what she was doing.",2
"782",82,8,"I would try to get the family's attention to ask if the teenager is with them.",8
"783",83,8,"I would mind my own business on this one. It's not my job to play detective nor is it my job to secure their belongings. ",4
"784",84,8,"take them along",-99
"785",85,8,"I would ask the teenager why they weren't out with the rest of their family and see how they react.",2
"786",86,8,"First catch the teenager",0
"787",87,8,"ignore the teen",4
"788",88,8,"Ask one of the parents if that is theirs or not out of concern.",2
"789",89,8,"I don't care about that unless the family shout or asking any help",4
"790",90,8,"I would mind my own business, but notify the family when they come back",0
"791",91,8,"I would mention it to the family.",1
"792",92,8,"I would try and stop this pilfering from happening. ",0
"793",93,8,"Ignore and stay out of it",4
"794",94,8,"Ask them who they are and what they are doing.",2
"795",95,8,"I would call out to one of the members and tell them to confirm whether that is one of them",8
"796",96,8,"alert the party",8
"797",97,8,"Continue to watch the teenager and alert the family after they return",6
"798",98,8,"Go to the family and discreetly ask if the teen is part of the family.",1
"799",99,8,"Do nothing unless the family says something is wrong and give them a description of the person.",0
"800",100,8,"Yell ""Hey, look at THAT!"" loudly enough that both the teenager and the family look up.",8
"801",1,9,"Call 911. They may be ill",1
"802",2,9,"I will call 911 and let them know of this driver.",1
"803",3,9,"Call 911 and let them know.",1
"804",4,9,"pull to a different road",4
"805",5,9,"Keep my distance and turn away from them as soon as possible.",4
"806",6,9,"Call 911 and stay far away from them.",1
"807",7,9,"Call the police and report it.",1
"808",8,9,"honk at them a lot to see if they drive better",5
"809",9,9,"I would call 911 and report the licene plate number and car make/model.",1
"810",10,9,"I would slow down and call the police and tell them about the driver.",1
"811",11,9,"call 911.",1
"812",12,9,"call 9-1-1 and give them the person's license plate number",1
"813",13,9,"Honk my horn, they may just be sleepy.",5
"814",14,9,"call 911",1
"815",15,9,"Call 911 and keep following from a safe distance",1
"816",16,9,"I would honk and try to remember to license plate number. I would take another street to drive home, and call the police if I remember the license plate number by the time I get home.",0
"817",17,9,"call police and give his license plate",1
"818",18,9,"give the car plenty of space and call 911",1
"819",19,9,"Call 911 to report the driver.",1
"820",20,9,"I would slow down and call 911 to let the police know. ",6
"821",21,9,"I had said that stop the car and I will have ride the car",-99
"822",22,9,"See how long they continue the behavior. Are they just preoccupied or something more? If they continued I would call 911 and tell them something was wrong with the driver. But not mention intoxicated because it could be a medical emergency. ",1
"823",23,9,"Call the police",1
"824",24,9,"slow down to get away from the driver",6
"825",25,9,"I would find a place to stop for half an hour, else I would turn down a different road and take the alternate route.",0
"826",26,9,"Stay back and wish him the best, maybe call 911 if it really gets bad.",6
"827",27,9,"I would call the cops.",1
"828",28,9,"move away or stay far behind the driver",6
"829",29,9,"call 911 to let them know",1
"830",30,9,"I pull up to the driver and get his attention. Ask him to pull over and offer him a ride home if he parks his car.",16
"831",31,9,"Call the police and follow behind slowly",1
"832",32,9,"call 911",1
"833",33,9,"call police",1
"834",34,9,"call 911",1
"835",35,9,"Call the cops",1
"836",36,9,"Call emergency services",1
"837",37,9,"flag them down",13
"838",38,9,"I would ask any passengers in the car to call the police. If I was alone, I would call myself.",1
"839",39,9,"give distance and continue home.",6
"840",40,9,"I would distance myself from the other vehicle to avoid a potential crash.",6
"841",41,9,"Drive down another road to get home",4
"842",42,9,"stay behind them and call cops",1
"843",43,9,"stay far behind him in case of an accident and call the police",1
"844",44,9,"Call police",1
"845",45,9,"Avoid the driver (slowing down to keep my distance) and make note of their license plate to potentially notify the authorities",6
"846",46,9,"I would try to put a lot of distance between us and call 911",1
"847",47,9,"Beep, flash lights, pull off to the shoulder to let them by. Call the police.",0
"848",48,9,"Get as far away from them as possible and call the police ",6
"849",49,9,"drop way back turn off if you can and call polic",1
"850",50,9,"I'd continue to follow them until they reached their destination safely; if there was heavy traffic, I'd report their license plate to 911.",8
"851",51,9,"Slow up and make sure I have room to stop if there is an accident.",6
"852",52,9,"I would call 911",1
"853",53,9,"Call the police and report the person so that no one gets harmed.",1
"854",54,9,"Call the cops",1
"855",55,9,"Start pulling over to the side of the road until the driver passes and then call 911.",1
"856",56,9,"Call 911 to come and check out the guy",1
"857",57,9,"I would flash my lights at the car to see if that gets them to pay more attention. If not, I would continue to follow them to see if they arrived somewhere safely. ",9
"858",58,9,"I would call the police on a hands free device and follow from a safe distance, to make sure no one got hurt. ",1
"859",59,9,"I would call the police.",1
"860",60,9,"Drive carefully and try and get around them to minimize risk of driving into them or them driving into me. ",3
"861",61,9,"I would call 911.",1
"862",62,9,"Drive past him.",3
"863",63,9,"Call 911",1
"864",64,9,"The road is the car of die ",-99
"865",65,9,"I'd maintain a safe distance from the driver and monitor them more as well as get the license plate and vehicle info. Then pull over and report this to 911",11
"866",66,9,"I would call the police and give them my location and a license plate number",1
"867",67,9,"Call the police",1
"868",68,9,"I would call 911 and report a possibly impaired driver. ",1
"869",69,9,"I would flash and honk my horn to get theior attention. If this didn't work I would call 911 and notify them and follow the individual at distance to try and keep them safe and to help if anything happens.",5
"870",70,9,"Stay back and call 911",1
"871",71,9,"Call 911 and report the driver.",1
"872",72,9,"driving home on a two-lane road and think",-99
"873",73,9,"Pull over as far to the right as possible and stop, get out of the car (if time allows) and call 911",2
"874",74,9,"I stop it",-99
"875",75,9,"I would most likely call the police and let them know about it, if I truly believed they were a threat to others on the road and drunk.",1
"876",76,9,"I would wait until the next intersection and immediately change routes. I would also call 911 on the driver.",4
"877",77,9,"I would continue to follow at a safe distance while I call the police and let them know the situation. I believe this person and everyone on the roads safety is a first priority.",1
"878",78,9,"Let space form between us and call the highway patrol",1
"879",79,9,"I would follow behind the vehicle at a safe distance and get the license number and call the police and follow the car until they got there.",0
"880",80,9,"Call 911.",1
"881",81,9,"I decide to call 911 and report the car in front of me I give the 911 the cars license plate number and tell them what the car is doing slowly drifting between the two lanes.",1
"882",82,9,"I would stay far back of the driver and call 911.",1
"883",83,9,"I would take notice of their license plate number and car description and I would call the police",1
"884",84,9,"pull him over",13
"885",85,9,"I would report them.",1
"886",86,9,"Get back a way",6
"887",87,9,"try to avoid the driver",6
"888",88,9,"Call the police and report it.",1
"889",89,9,"I will drive the car",-99
"890",90,9,"I would call the police.",1
"891",91,9,"I would call 911 before they wreck.",1
"892",92,9,"I would speed up and try and pass him. ",3
"893",93,9,"Get the license plate number and call the cops",1
"894",94,9,"Call Highway Patrol and provide them with the license plate in order to locate the driver. ",1
"895",95,9,"Slow down",6
"896",96,9,"call 911",1
"897",97,9,"Honk and put my bright lights on to warn the driver.",5
"898",98,9,"Call 911.",1
"899",99,9,"Drive slow behind him and call the police.",1
"900",100,9,"call 911",1
"901",1,10,"Sorry I cannot help you",5
"902",2,10,"If this woman approached me, I would offer to buy her a taxi.",7
"903",3,10,"Apologize to her and let her know that I don't give rides to strangers.",5
"904",4,10,"tell her to try someone else",5
"905",5,10,"Apologize and say I can not give them a ride.",5
"906",6,10,"Offer to call her a Lyft or with a few dollars.",7
"907",7,10,"Tell her I am sorry but I cant give her a ride.",5
"908",8,10,"I would say I can't and leave unless I really had time to help",5
"909",9,10,"I would ask for gas money in return.",4
"910",10,10,"I would say that I have other things that I need to so and that I am sorry that I could not help. ",5
"911",11,10,"Give her money for a cab.",8
"912",12,10,"politely explain that I don't feel comfortable giving her a ride",5
"913",13,10,"Tell her there will be someone else along that may be able to help, but I need to pick up my child before Daycare closes. ",5
"914",14,10,"Tell her that I don't have time",5
"915",15,10,"Apologize and decline",5
"916",16,10,"I would decline.",5
"917",17,10,"either take her or take her that direction as far as im going",2
"918",18,10,"i would offer to call someone for her but not take her",7
"919",19,10,"I would decline the request and instead suggest she call a taxi or call one for her.",10
"920",20,10,"I wouldn't give her a ride. I don't trust people who approach me at gas stations.",5
"921",21,10,"I have decide for help",-99
"922",22,10,"I wouldn't take them, I don't trust anyone. If I had the extra money I would probably offer an uber.",5
"923",23,10,"I use my intuition and likely take  her",2
"924",24,10,"lie and tell her i'm headed somewhere else",6
"925",25,10,"I would tell her that I'm not going that way.",6
"926",26,10,"Talk to her to get a feel for her and if safe take her 10 miles further.",0
"927",27,10,"I would politely tell them no.",5
"928",28,10,"give her a ride",2
"929",29,10,"okay I will do it",2
"930",30,10,"I let her know that I have a time to keep and offer to order her an uber to where she is heading on my dime.",7
"931",31,10,"Tell her sorry I can't take her",5
"932",32,10,"help the woman out",2
"933",33,10,"give her a ride",2
"934",34,10,"nope, say sorry",5
"935",35,10,"Tell her I will take her as far as I am going.",3
"936",36,10,"apologize and tell her  no",5
"937",37,10,"tell her no",5
"938",38,10,"I would drive her, because an extra 20 miles isn't much of an issue",2
"939",39,10,"decline",5
"940",40,10,"I would have to respectfully decline her request.",5
"941",41,10,"Give her a ride",2
"942",42,10,"give her money for a cab",8
"943",43,10,"I'd say sorry I'm not going that far",5
"944",44,10,"Say that i can't help",5
"945",45,10,"Tell her sorry, but I cannot take her there",5
"946",46,10,"never pick up hitchhikers. tell her sorry i cant drive her.",5
"947",47,10,"Politely decline. I don't let strangers in my car for any reason, it's nothing personal.",5
"948",48,10,"No I don't give rides to strangers sorry",5
"949",49,10,"help the lady",2
"950",50,10,"I would decline giving them a ride, but suggest Uber or a taxi; too unsafe to take a stranger",10
"951",51,10,"Politely pass on offering a ride.",5
"952",52,10,"Tell the person I have an appointment and can not give her a ride.",0
"953",53,10,"I'd ask her if she'd be ok with me dropping her off near my house which is 10 miles away from her destination and she could go from there.",3
"954",54,10,"Call my wife and tell her I am picking her up, keep her on the phone and we drop the woman off",0
"955",55,10,"I would lie and tell her that unfortunately, I am not going in that direction.",6
"956",56,10,"I will give her a ride",2
"957",57,10,"I would giver her some money for a cab or Uber ride to her destination. ",8
"958",58,10,"I would offer to call her a taxi or give a few dollars for bus fare if i had it, i would not give the woman a ride. ",7
"959",59,10,"I would give her a ride.",2
"960",60,10,"I would say that I was sorry but I am unable to give the woman a ride. ",5
"961",61,10,"I would say no and apologize and say I'm not heading in that direction. I could give her some money to find a different ride over there.",0
"962",62,10,"Give her a ride.",2
"963",63,10,"Say no",5
"964",64,10,"The planned is city on the nerar.",-99
"965",65,10,"I would most likely politely decline the ride and then offer instead to call the woman a ride service",7
"966",66,10,"I would offer to buy her an uber home",7
"967",67,10,"Do not give the stranger a ride",5
"968",68,10,"I would tell her I'm going the other way and I can't. ",6
"969",69,10,"I most likely wouldn't offer the lady a ride, but I would instead offer her an uber or taxi to get her way she is going and pay for it.",7
"970",70,10,"call 911 and see what they can do for the woman.",12
"971",71,10,"Tell her no.",5
"972",72,10,"yes woman approaches you to ask for a ride to a nearby city",-99
